,Tweets,Case_Folding,Data_Cleaning,Tokenize,Normalization,Stopwords,Stemming,Label,
901,b'RT @CNNIndonesia: Aktivis perempuan Devi Asmarani mengatakan Permendikbud PPKS sangat dibutuhkan di lingkungan perguruan tinggi lantaran se\xe2\x80\xa6',b'rt @cnnindonesia: aktivis perempuan devi asmarani mengatakan permendikbud ppks sangat dibutuhkan di lingkungan perguruan tinggi lantaran se\xe2\x80\xa6', aktivis perempuan devi asmarani mengatakan permendikbud ppks sangat dibutuhkan di lingkungan perguruan tinggi lantaran se  xa,"['aktivis', 'perempuan', 'devi', 'asmarani', 'mengatakan', 'permendikbud', 'ppks', 'sangat', 'dibutuhkan', 'di', 'lingkungan', 'perguruan', 'tinggi', 'lantaran', 'se', 'xa']","['aktivis', 'perempuan', 'devi', 'asmarani', 'mengatakan', 'permendikbud', 'ppks', 'sangat', 'dibutuhkan', 'di', 'lingkungan', 'perguruan', 'tinggi', 'lantaran', 'se', 'xa']",aktivis perempuan devi asmarani permendikbud ppks dibutuhkan lingkungan perguruan lantaran,aktivis perempuan devi asmarani permendikbud ppks butuh lingkung guru lantar,1,
5353,"b'RT @GunRomli: Al-Baqarah 41: Janganlah kamu jual ayat-ayat-Ku dengan harga murah, tp bagi kelompok yg jg menolak Permendikbudristek PPKS in\xe2\x80\xa6'","b'rt @gunromli: al-baqarah 41: janganlah kamu jual ayat-ayat-ku dengan harga murah, tp bagi kelompok yg jg menolak permendikbudristek ppks in\xe2\x80\xa6'", al baqarah janganlah kamu jual ayat ayat ku dengan harga murah tp bagi kelompok yg jg menolak permendikbudristek ppks in  xa,"['al', 'baqarah', 'janganlah', 'kamu', 'jual', 'ayat', 'ayat', 'ku', 'dengan', 'harga', 'murah', 'tp', 'bagi', 'kelompok', 'yg', 'jg', 'menolak', 'permendikbudristek', 'ppks', 'in', 'xa']","['al', 'baqarah', 'janganlah', 'kamu', 'jual', 'ayat', 'ayat', 'ku', 'dengan', 'harga', 'murah', 'tp', 'bagi', 'kelompok', 'yg', 'jg', 'menolak', 'permendikbudristek', 'ppks', 'in', 'xa']",al baqarah jual ayat ayat ku harga murah tp kelompok yg jg menolak permendikbudristek ppks in,al baqarah jual ayat ayat ku harga murah tp kelompok yg jg tolak permendikbudristek ppks in,0,
66,"b'RT @muslimahnewscom: Alhasil bagi kalangan yang mendukung Permen PPKS, menganggap bahwa Permen ini sebagai terobosan karena ""berperspektif\xe2\x80\xa6'","b'rt @muslimahnewscom: alhasil bagi kalangan yang mendukung permen ppks, menganggap bahwa permen ini sebagai terobosan karena ""berperspektif\xe2\x80\xa6'", alhasil bagi kalangan yang mendukung permen ppks menganggap bahwa permen ini sebagai terobosan karena berperspektif  xa,"['alhasil', 'bagi', 'kalangan', 'yang', 'mendukung', 'permen', 'ppks', 'menganggap', 'bahwa', 'permen', 'ini', 'sebagai', 'terobosan', 'karena', 'berperspektif', 'xa']","['alhasil', 'bagi', 'kalangan', 'yang', 'mendukung', 'permen', 'ppks', 'menganggap', 'bahwa', 'permen', 'ini', 'sebagai', 'terobosan', 'karena', 'berperspektif', 'xa']",alhasil kalangan mendukung permen ppks menganggap permen terobosan berperspektif,alhasil kalang dukung permen ppks anggap permen terobos perspektif,1,
5384,"b'RT @asumsico: Alih-alih memperkarakan frasa ""tanpa persetujuan korban"", sejatinya Permendikbud PPKS dilihat sebagai alarm tegas atas tindak\xe2\x80\xa6'","b'rt @asumsico: alih-alih memperkarakan frasa ""tanpa persetujuan korban"", sejatinya permendikbud ppks dilihat sebagai alarm tegas atas tindak\xe2\x80\xa6'", alih alih memperkarakan frasa tanpa persetujuan korban sejatinya permendikbud ppks dilihat sebagai alarm tegas atas tindak  xa,"['alih', 'alih', 'memperkarakan', 'frasa', 'tanpa', 'persetujuan', 'korban', 'sejatinya', 'permendikbud', 'ppks', 'dilihat', 'sebagai', 'alarm', 'tegas', 'atas', 'tindak', 'xa']","['alih', 'alih', 'memperkarakan', 'frasa', 'tanpa', 'persetujuan', 'korban', 'sejatinya', 'permendikbud', 'ppks', 'dilihat', 'sebagai', 'alarm', 'tegas', 'atas', 'tindak', 'xa']",alih alih memperkarakan frasa persetujuan korban sejatinya permendikbud ppks alarm tindak,alih alih perkara frasa tuju korban sejati permendikbud ppks alarm tindak,1,
1149,b'RT @muslimahnewscom: Apakah Permendikbudristek 30/2021 (Permen PPKS) pada Perguruan Tinggi semakin menumbuhsuburkan pergaulan bebas?',b'rt @muslimahnewscom: apakah permendikbudristek 30/2021 (permen ppks) pada perguruan tinggi semakin menumbuhsuburkan pergaulan bebas?', apakah permendikbudristek permen ppks pada perguruan tinggi semakin menumbuhsuburkan pergaulan bebas,"['apakah', 'permendikbudristek', 'permen', 'ppks', 'pada', 'perguruan', 'tinggi', 'semakin', 'menumbuhsuburkan', 'pergaulan', 'bebas']","['apakah', 'permendikbudristek', 'permen', 'ppks', 'pada', 'perguruan', 'tinggi', 'semakin', 'menumbuhsuburkan', 'pergaulan', 'bebas']",permendikbudristek permen ppks perguruan menumbuhsuburkan pergaulan bebas,permendikbudristek permen ppks guru menumbuhsuburkan gaul bebas,,9
950,b'RT @fahmirf10: Artikel terbaru saya di Kolom @detikcom merespon untuk segera mengesahkan RUU TPKS dan poin penting Permendikbudristek 30/20\xe2\x80\xa6',b'rt @fahmirf10: artikel terbaru saya di kolom @detikcom merespon untuk segera mengesahkan ruu tpks dan poin penting permendikbudristek 30/20\xe2\x80\xa6', artikel terbaru saya di kolom merespon untuk segera mengesahkan ruu tpks dan poin penting permendikbudristek  xa,"['artikel', 'terbaru', 'saya', 'di', 'kolom', 'merespon', 'untuk', 'segera', 'mengesahkan', 'ruu', 'tpks', 'dan', 'poin', 'penting', 'permendikbudristek', 'xa']","['artikel', 'terbaru', 'saya', 'di', 'kolom', 'merespon', 'untuk', 'segera', 'mengesahkan', 'ruu', 'tpks', 'dan', 'poin', 'penting', 'permendikbudristek', 'xa']",artikel terbaru kolom merespon mengesahkan ruu tpks poin permendikbudristek,artikel baru kolom merespon kesah ruu tpks poin permendikbudristek,1,
785,b'RT @asumsico: Aturan yang diteken Nadiem Makarim untuk mencegah dan menangani kekerasan seksual di kampus dinilai sudah tepat dan harus did\xe2\x80\xa6',b'rt @asumsico: aturan yang diteken nadiem makarim untuk mencegah dan menangani kekerasan seksual di kampus dinilai sudah tepat dan harus did\xe2\x80\xa6', aturan yang diteken nadiem makarim untuk mencegah dan menangani kekerasan seksual di kampus dinilai sudah tepat dan harus did  xa,"['aturan', 'yang', 'diteken', 'nadiem', 'makarim', 'untuk', 'mencegah', 'dan', 'menangani', 'kekerasan', 'seksual', 'di', 'kampus', 'dinilai', 'sudah', 'tepat', 'dan', 'harus', 'did', 'xa']","['aturan', 'yang', 'diteken', 'nadiem', 'makarim', 'untuk', 'mencegah', 'dan', 'menangani', 'kekerasan', 'seksual', 'di', 'kampus', 'dinilai', 'sudah', 'tepat', 'dan', 'harus', 'did', 'xa']",aturan diteken nadiem makarim mencegah menangani kekerasan seksual kampus dinilai did,atur teken nadiem makarim cegah tangan keras seksual kampus nilai did,1,
897,b'RT @PPKS_ID: Bagaimana dosis pupuk tunggal TBM kelapa sawit pada tanah mineral?\n.\nSimak informasi ini dan bagikan kepada teman-teman anda.\xe2\x80\xa6',b'rt @ppks_id: bagaimana dosis pupuk tunggal tbm kelapa sawit pada tanah mineral?\n.\nsimak informasi ini dan bagikan kepada teman-teman anda.\xe2\x80\xa6', bagaimana dosis pupuk tunggal tbm kelapa sawit pada tanah mineral nsimak informasi ini dan bagikan kepada teman teman anda  xa,"['bagaimana', 'dosis', 'pupuk', 'tunggal', 'tbm', 'kelapa', 'sawit', 'pada', 'tanah', 'mineral', 'nsimak', 'informasi', 'ini', 'dan', 'bagikan', 'kepada', 'teman', 'teman', 'anda', 'xa']","['bagaimana', 'dosis', 'pupuk', 'tunggal', 'tbm', 'kelapa', 'sawit', 'pada', 'tanah', 'mineral', 'nsimak', 'informasi', 'ini', 'dan', 'bagikan', 'kepada', 'teman', 'teman', 'anda', 'xa']",dosis pupuk tunggal tbm kelapa sawit tanah mineral nsimak informasi bagikan teman teman,dosis pupuk tunggal tbm kelapa sawit tanah mineral nsimak informasi bagi teman teman,,9
5261,b'RT @PPKS_ID: Bagaimana keunggulan tanaman ini untuk kesehatan maupun pendapatan khususnya bagi pekebun sawit?\nSimak PPKS Note berikut sahab\xe2\x80\xa6',b'rt @ppks_id: bagaimana keunggulan tanaman ini untuk kesehatan maupun pendapatan khususnya bagi pekebun sawit?\nsimak ppks note berikut sahab\xe2\x80\xa6', bagaimana keunggulan tanaman ini untuk kesehatan maupun pendapatan khususnya bagi pekebun sawit nsimak ppks note berikut sahab  xa,"['bagaimana', 'keunggulan', 'tanaman', 'ini', 'untuk', 'kesehatan', 'maupun', 'pendapatan', 'khususnya', 'bagi', 'pekebun', 'sawit', 'nsimak', 'ppks', 'note', 'berikut', 'sahab', 'xa']","['bagaimana', 'keunggulan', 'tanaman', 'ini', 'untuk', 'kesehatan', 'maupun', 'pendapatan', 'khususnya', 'bagi', 'pekebun', 'sawit', 'nsimak', 'ppks', 'note', 'berikut', 'sahab', 'xa']",keunggulan tanaman kesehatan pendapatan pekebun sawit nsimak ppks note sahab,unggul tanam sehat dapat kebun sawit nsimak ppks note sahab,,9
5381,b'RT @CakraWikara: [PERMEN PPKS]\n\n@Kemdikbud_RI baru saja mengesahkan Peraturan Menteri (Permen) Nomor 30 Tahun 2021 tentang Pencegahan dan P\xe2\x80\xa6',b'rt @cakrawikara: [permen ppks]\n\n@kemdikbud_ri baru saja mengesahkan peraturan menteri (permen) nomor 30 tahun 2021 tentang pencegahan dan p\xe2\x80\xa6', baru saja mengesahkan peraturan menteri permen nomor tahun tentang pencegahan dan  xa,"['baru', 'saja', 'mengesahkan', 'peraturan', 'menteri', 'permen', 'nomor', 'tahun', 'tentang', 'pencegahan', 'dan', 'xa']","['baru', 'saja', 'mengesahkan', 'peraturan', 'menteri', 'permen', 'nomor', 'tahun', 'tentang', 'pencegahan', 'dan', 'xa']",mengesahkan peraturan menteri permen nomor pencegahan,kesah atur menteri permen nomor cegah,,9
394,b'RT @DivHumas_Polri: 21 Bentuk Kekerasan Seksual Yang Dilarang\n\nKemendikbud Ristek resmi mengesahkan Permendikbud Nomor 30 Tahun 2021 tentan\xe2\x80\xa6',b'rt @divhumas_polri: 21 bentuk kekerasan seksual yang dilarang\n\nkemendikbud ristek resmi mengesahkan permendikbud nomor 30 tahun 2021 tentan\xe2\x80\xa6', bentuk kekerasan seksual yang dilarang nkemendikbud ristek resmi mengesahkan permendikbud nomor tahun tentan  xa,"['bentuk', 'kekerasan', 'seksual', 'yang', 'dilarang', 'nkemendikbud', 'ristek', 'resmi', 'mengesahkan', 'permendikbud', 'nomor', 'tahun', 'tentan', 'xa']","['bentuk', 'kekerasan', 'seksual', 'yang', 'dilarang', 'nkemendikbud', 'ristek', 'resmi', 'mengesahkan', 'permendikbud', 'nomor', 'tahun', 'tentan', 'xa']",bentuk kekerasan seksual dilarang nkemendikbud ristek resmi mengesahkan permendikbud nomor tentan,bentuk keras seksual larang nkemendikbud ristek resmi kesah permendikbud nomor tentan,1,
1101,"b'RT @Jaring_UburUbur: @bertanyarl berarti selama ini bnyk yg ngalamin tpi gamau speak up krn ngerasa gada payung untuk mereka, bayangin bati\xe2\x80\xa6'","b'rt @jaring_uburubur: @bertanyarl berarti selama ini bnyk yg ngalamin tpi gamau speak up krn ngerasa gada payung untuk mereka, bayangin bati\xe2\x80\xa6'", berarti selama ini bnyk yg ngalamin tpi gamau speak up krn ngerasa gada payung untuk mereka bayangin bati  xa,"['berarti', 'selama', 'ini', 'bnyk', 'yg', 'ngalamin', 'tpi', 'gamau', 'speak', 'up', 'krn', 'ngerasa', 'gada', 'payung', 'untuk', 'mereka', 'bayangin', 'bati', 'xa']","['berarti', 'selama', 'ini', 'bnyk', 'yg', 'ngalamin', 'tpi', 'gamau', 'speak', 'up', 'krn', 'ngerasa', 'gada', 'payung', 'untuk', 'mereka', 'bayangin', 'bati', 'xa']",bnyk yg ngalamin tpi gamau speak up krn ngerasa gada payung bayangin bati,bnyk yg ngalamin tpi gamau speak up krn ngerasa gada payung bayangin bati,1,
5382,b'RT @eradotid: Berikut 21 bentuk kekerasan seksual yang diatur dalam Permendikbud Nomor 30 Tahun 2021 tentang PPKS di lingkungan kampus: htt\xe2\x80\xa6',b'rt @eradotid: berikut 21 bentuk kekerasan seksual yang diatur dalam permendikbud nomor 30 tahun 2021 tentang ppks di lingkungan kampus: htt\xe2\x80\xa6', berikut bentuk kekerasan seksual yang diatur dalam permendikbud nomor tahun tentang ppks di lingkungan kampus htt  xa,"['berikut', 'bentuk', 'kekerasan', 'seksual', 'yang', 'diatur', 'dalam', 'permendikbud', 'nomor', 'tahun', 'tentang', 'ppks', 'di', 'lingkungan', 'kampus', 'htt', 'xa']","['berikut', 'bentuk', 'kekerasan', 'seksual', 'yang', 'diatur', 'dalam', 'permendikbud', 'nomor', 'tahun', 'tentang', 'ppks', 'di', 'lingkungan', 'kampus', 'htt', 'xa']",bentuk kekerasan seksual diatur permendikbud nomor ppks lingkungan kampus htt,bentuk keras seksual atur permendikbud nomor ppks lingkung kampus htt,1,
999,"b'RT @Nisanurulhs: BESOK\nAksi 16 HAKTP\n\nDukung Permendikbud Ristek PPKS,\nAmankan RUU TPKS\nSahkan RUU PPRT\n\n#16HAKTP https://t.co/GEMrCohV29'","b'rt @nisanurulhs: besok\naksi 16 haktp\n\ndukung permendikbud ristek ppks,\namankan ruu tpks\nsahkan ruu pprt\n\n#16haktp https://t.co/gemrcohv29'", besok naksi haktp ndukung permendikbud ristek ppks namankan ruu tpks nsahkan ruu pp haktp,"['besok', 'naksi', 'haktp', 'ndukung', 'permendikbud', 'ristek', 'ppks', 'namankan', 'ruu', 'tpks', 'nsahkan', 'ruu', 'pp', 'haktp']","['besok', 'naksi', 'haktp', 'ndukung', 'permendikbud', 'ristek', 'ppks', 'namankan', 'ruu', 'tpks', 'nsahkan', 'ruu', 'pp', 'haktp']",besok naksi haktp ndukung permendikbud ristek ppks namankan ruu tpks nsahkan ruu pp haktp,besok naksi haktp ndukung permendikbud ristek ppks namankan ruu tpks nsahkan ruu pp haktp,1,
5405,"b'RT @OposisiCerdas: Buntut Permendikbud PPKS, Nadiem Makarim Disomasi Ormas Pemuda\nhttps://t.co/pg10UjUEe2'","b'rt @oposisicerdas: buntut permendikbud ppks, nadiem makarim disomasi ormas pemuda\nhttps://t.co/pg10ujuee2'", buntut permendikbud ppks nadiem makarim disomasi ormas pemuda,"['buntut', 'permendikbud', 'ppks', 'nadiem', 'makarim', 'disomasi', 'ormas', 'pemuda']","['buntut', 'permendikbud', 'ppks', 'nadiem', 'makarim', 'disomasi', 'ormas', 'pemuda']",buntut permendikbud ppks nadiem makarim disomasi ormas pemuda,buntut permendikbud ppks nadiem makarim somasi ormas pemuda,1,
139,b'RT @DPP_PKB: Cak Imin Dukung Permendikbud PPKS: Kekerasan Seksual Sangat Meresahkan\n\nhttps://t.co/HwC8Q78iEN',b'rt @dpp_pkb: cak imin dukung permendikbud ppks: kekerasan seksual sangat meresahkan\n\nhttps://t.co/hwc8q78ien', cak imin dukung permendikbud ppks kekerasan seksual sangat meresahkan,"['cak', 'imin', 'dukung', 'permendikbud', 'ppks', 'kekerasan', 'seksual', 'sangat', 'meresahkan']","['cak', 'imin', 'dukung', 'permendikbud', 'ppks', 'kekerasan', 'seksual', 'sangat', 'meresahkan']",cak imin dukung permendikbud ppks kekerasan seksual meresahkan,cak imin dukung permendikbud ppks keras seksual resah,1,
4922,"b'\xe2\x80\x9cBerarti kalau korban setuju, berarti boleh?\xe2\x80\x9d mungkin itu gambaran sederhananya.\nhttps://t.co/MWIBKw59Ij'","b'\xe2\x80\x9cberarti kalau korban setuju, berarti boleh?\xe2\x80\x9d mungkin itu gambaran sederhananya.\nhttps://t.co/mwibkw59ij'", cberarti kalau korban setuju berarti boleh  mungkin itu gambaran sederhananya,"['cberarti', 'kalau', 'korban', 'setuju', 'berarti', 'boleh', 'mungkin', 'itu', 'gambaran', 'sederhananya']","['cberarti', 'kalau', 'korban', 'setuju', 'berarti', 'boleh', 'mungkin', 'itu', 'gambaran', 'sederhananya']",cberarti korban setuju gambaran sederhananya,cberarti korban tuju gambar sederhana,0,
292,b'RT @muslimahnewscom: Dari sini nampak jelas bahwa dalam Permen PPKS ini masih menyisakan PR bagi penanganan seks bebas di lingkungan Pergur\xe2\x80\xa6',b'rt @muslimahnewscom: dari sini nampak jelas bahwa dalam permen ppks ini masih menyisakan pr bagi penanganan seks bebas di lingkungan pergur\xe2\x80\xa6', dari sini nampak jelas bahwa dalam permen ppks ini masih menyisakan pr bagi penanganan seks bebas di lingkungan pergur  xa,"['dari', 'sini', 'nampak', 'jelas', 'bahwa', 'dalam', 'permen', 'ppks', 'ini', 'masih', 'menyisakan', 'pr', 'bagi', 'penanganan', 'seks', 'bebas', 'di', 'lingkungan', 'pergur', 'xa']","['dari', 'sini', 'nampak', 'jelas', 'bahwa', 'dalam', 'permen', 'ppks', 'ini', 'masih', 'menyisakan', 'pr', 'bagi', 'penanganan', 'seks', 'bebas', 'di', 'lingkungan', 'pergur', 'xa']",nampak permen ppks menyisakan pr penanganan seks bebas lingkungan pergur,nampak permen ppks sisa pr tangan seks bebas lingkung pergur,0,
945,"b'RT @eradotid: Dari sudut pandangmu, kenapa sih kasus seperti ini bisa terjadi? Bahkan melibatkan anak-anak di bawah umur.\n\nBukankah RUU PKS\xe2\x80\xa6'","b'rt @eradotid: dari sudut pandangmu, kenapa sih kasus seperti ini bisa terjadi? bahkan melibatkan anak-anak di bawah umur.\n\nbukankah ruu pks\xe2\x80\xa6'", dari sudut pandangmu kenapa sih kasus seperti ini bisa terjadi bahkan melibatkan anak anak di bawah umur nbukankah ruu pks  xa,"['dari', 'sudut', 'pandangmu', 'kenapa', 'sih', 'kasus', 'seperti', 'ini', 'bisa', 'terjadi', 'bahkan', 'melibatkan', 'anak', 'anak', 'di', 'bawah', 'umur', 'nbukankah', 'ruu', 'pks', 'xa']","['dari', 'sudut', 'pandangmu', 'kenapa', 'sih', 'kasus', 'seperti', 'ini', 'bisa', 'terjadi', 'bahkan', 'melibatkan', 'anak', 'anak', 'di', 'bawah', 'umur', 'nbukankah', 'ruu', 'pks', 'xa']",sudut pandangmu sih melibatkan anak anak umur nbukankah ruu pks,sudut pandang sih libat anak anak umur nbukankah ruu pks,0,
263,"b'RT @detikcom: Demonstrasi mahasiswa di Medan terkait Permendikbud PPKS menjadi sorotan. Pasalnya dalam unjuk rasa itu, mahasiswa menyebut P\xe2\x80\xa6'","b'rt @detikcom: demonstrasi mahasiswa di medan terkait permendikbud ppks menjadi sorotan. pasalnya dalam unjuk rasa itu, mahasiswa menyebut p\xe2\x80\xa6'", demonstrasi mahasiswa di medan terkait permendikbud ppks menjadi sorotan pasalnya dalam unjuk rasa itu mahasiswa menyebut  xa,"['demonstrasi', 'mahasiswa', 'di', 'medan', 'terkait', 'permendikbud', 'ppks', 'menjadi', 'sorotan', 'pasalnya', 'dalam', 'unjuk', 'rasa', 'itu', 'mahasiswa', 'menyebut', 'xa']","['demonstrasi', 'mahasiswa', 'di', 'medan', 'terkait', 'permendikbud', 'ppks', 'menjadi', 'sorotan', 'pasalnya', 'dalam', 'unjuk', 'rasa', 'itu', 'mahasiswa', 'menyebut', 'xa']",demonstrasi mahasiswa medan terkait permendikbud ppks sorotan pasalnya unjuk mahasiswa menyebut,demonstrasi mahasiswa medan kait permendikbud ppks sorot pasal unjuk mahasiswa sebut,1,
784,b'RT @asumsico: Di Asumsi Bersuara kali ini @rayestu berbincang dengan @tunggalp terkait aturan Permendikbudristek Nomor 30 Tahun 2021 tentan\xe2\x80\xa6',b'rt @asumsico: di asumsi bersuara kali ini @rayestu berbincang dengan @tunggalp terkait aturan permendikbudristek nomor 30 tahun 2021 tentan\xe2\x80\xa6', di asumsi bersuara kali ini berbincang dengan terkait aturan permendikbudristek nomor tahun tentan  xa,"['di', 'asumsi', 'bersuara', 'kali', 'ini', 'berbincang', 'dengan', 'terkait', 'aturan', 'permendikbudristek', 'nomor', 'tahun', 'tentan', 'xa']","['di', 'asumsi', 'bersuara', 'kali', 'ini', 'berbincang', 'dengan', 'terkait', 'aturan', 'permendikbudristek', 'nomor', 'tahun', 'tentan', 'xa']",asumsi bersuara kali berbincang terkait aturan permendikbudristek nomor tentan,asumsi suara kali bincang kait atur permendikbudristek nomor tentan,,9
5388,"b'RT @angga_fzn: Di sini siapa yang sepakat bahwa kampus adalah tempat pendidikan, bukan pelecehan? \xf0\x9f\x98\xa4\xf0\x9f\x98\xa4\xf0\x9f\x98\xa4\n\nGue mau sedikit cerita kenapa Permen\xe2\x80\xa6'","b'rt @angga_fzn: di sini siapa yang sepakat bahwa kampus adalah tempat pendidikan, bukan pelecehan? \xf0\x9f\x98\xa4\xf0\x9f\x98\xa4\xf0\x9f\x98\xa4\n\ngue mau sedikit cerita kenapa permen\xe2\x80\xa6'", di sini siapa yang sepakat bahwa kampus adalah tempat pendidikan bukan pelecehan xf xa xf xa xf xa ngue mau sedikit cerita kenapa permen  xa,"['di', 'sini', 'siapa', 'yang', 'sepakat', 'bahwa', 'kampus', 'adalah', 'tempat', 'pendidikan', 'bukan', 'pelecehan', 'xf', 'xa', 'xf', 'xa', 'xf', 'xa', 'ngue', 'mau', 'sedikit', 'cerita', 'kenapa', 'permen', 'xa']","['di', 'sini', 'siapa', 'yang', 'sepakat', 'bahwa', 'kampus', 'adalah', 'tempat', 'pendidikan', 'bukan', 'pelecehan', 'xf', 'xa', 'xf', 'xa', 'xf', 'xa', 'ngue', 'mau', 'sedikit', 'cerita', 'kenapa', 'permen', 'xa']",sepakat kampus pendidikan pelecehan xf xf xf ngue cerita permen,sepakat kampus didik leceh xf xf xf ngue cerita permen,,9
5397,"b'RT @identity_muslim: Gagasan liberal seksual consent yang menjadi ruh rumusan makna  kekerasan seksual dalam Permen PPKS, bukanlah hal baru\xe2\x80\xa6'","b'rt @identity_muslim: gagasan liberal seksual consent yang menjadi ruh rumusan makna  kekerasan seksual dalam permen ppks, bukanlah hal baru\xe2\x80\xa6'", gagasan liberal seksual consent yang menjadi ruh rumusan makna kekerasan seksual dalam permen ppks bukanlah hal baru  xa,"['gagasan', 'liberal', 'seksual', 'consent', 'yang', 'menjadi', 'ruh', 'rumusan', 'makna', 'kekerasan', 'seksual', 'dalam', 'permen', 'ppks', 'bukanlah', 'hal', 'baru', 'xa']","['gagasan', 'liberal', 'seksual', 'consent', 'yang', 'menjadi', 'ruh', 'rumusan', 'makna', 'kekerasan', 'seksual', 'dalam', 'permen', 'ppks', 'bukanlah', 'hal', 'baru', 'xa']",gagasan liberal seksual consent ruh rumusan makna kekerasan seksual permen ppks,gagas liberal seksual consent ruh rumus makna keras seksual permen ppks,0,
509,b'RT @cutiepaaw: GAIS ADA YANG MAU BANTU ISI KUISIONERKU TENTANG PERATURAN MENTRI  Pencegahan dan Penanganan Kekerasan Seksual (PPKS) ?mohon\xe2\x80\xa6',b'rt @cutiepaaw: gais ada yang mau bantu isi kuisionerku tentang peraturan mentri  pencegahan dan penanganan kekerasan seksual (ppks) ?mohon\xe2\x80\xa6', gais ada yang mau bantu isi kuisionerku tentang peraturan mentri pencegahan dan penanganan kekerasan seksual ppks mohon  xa,"['gais', 'ada', 'yang', 'mau', 'bantu', 'isi', 'kuisionerku', 'tentang', 'peraturan', 'mentri', 'pencegahan', 'dan', 'penanganan', 'kekerasan', 'seksual', 'ppks', 'mohon', 'xa']","['gais', 'ada', 'yang', 'mau', 'bantu', 'isi', 'kuisionerku', 'tentang', 'peraturan', 'mentri', 'pencegahan', 'dan', 'penanganan', 'kekerasan', 'seksual', 'ppks', 'mohon', 'xa']",gais bantu isi kuisionerku peraturan mentri pencegahan penanganan kekerasan seksual ppks mohon,gais bantu isi kuisionerku atur tri cegah tangan keras seksual ppks mohon,,9
774,b'RT @SantorinisSun: Gila udah berani terang2an gini!\nGubsu Edi ama Walkot Bobby harus berani tegas!\nAparat juga boleh bertindak nih.\nMasih m\xe2\x80\xa6',b'rt @santorinissun: gila udah berani terang2an gini!\ngubsu edi ama walkot bobby harus berani tegas!\naparat juga boleh bertindak nih.\nmasih m\xe2\x80\xa6', gila udah berani terang an gini ngubsu edi ama walkot bobby harus berani tegas naparat juga boleh bertindak nih nmasih  xa,"['gila', 'udah', 'berani', 'terang', 'an', 'gini', 'ngubsu', 'edi', 'ama', 'walkot', 'bobby', 'harus', 'berani', 'tegas', 'naparat', 'juga', 'boleh', 'bertindak', 'nih', 'nmasih', 'xa']","['gila', 'udah', 'berani', 'terang', 'an', 'gini', 'ngubsu', 'edi', 'ama', 'walkot', 'bobby', 'harus', 'berani', 'tegas', 'naparat', 'juga', 'boleh', 'bertindak', 'nih', 'nmasih', 'xa']",gila udah berani terang an gini ngubsu edi ama walkot bobby berani naparat bertindak nih nmasih,gila udah berani terang an gin ngubsu edi ama walkot bobby berani naparat tindak nih nmasih,1,
90,b'RT @HopeHelpsNet: Hadirnya Permendikbud-Ristek PPKS No. 30/2021 menunjukkan langkah progresif dari @Kemdikbud_RI @nadiemmakarim dalam hal p\xe2\x80\xa6',b'rt @hopehelpsnet: hadirnya permendikbud-ristek ppks no. 30/2021 menunjukkan langkah progresif dari @kemdikbud_ri @nadiemmakarim dalam hal p\xe2\x80\xa6', hadirnya permendikbud ristek ppks no menunjukkan langkah progresif dari dalam hal  xa,"['hadirnya', 'permendikbud', 'ristek', 'ppks', 'no', 'menunjukkan', 'langkah', 'progresif', 'dari', 'dalam', 'hal', 'xa']","['hadirnya', 'permendikbud', 'ristek', 'ppks', 'no', 'menunjukkan', 'langkah', 'progresif', 'dari', 'dalam', 'hal', 'xa']",hadirnya permendikbud ristek ppks no langkah progresif,hadir permendikbud ristek ppks no langkah progresif,1,
614,"b'RT @RatnaIntanKurn1: Hah !!!!\nPantaskah kita diamkan ???\n@mohmahfudmd\n@DivHumas_Polri\n\nMahasiswa di Medan Demo Dukung Khilafah, Tuding Perm\xe2\x80\xa6'","b'rt @ratnaintankurn1: hah !!!!\npantaskah kita diamkan ???\n@mohmahfudmd\n@divhumas_polri\n\nmahasiswa di medan demo dukung khilafah, tuding perm\xe2\x80\xa6'", hah npantaskah kita diamkan di medan demo dukung khilafah tuding perm  xa,"['hah', 'npantaskah', 'kita', 'diamkan', 'di', 'medan', 'demo', 'dukung', 'khilafah', 'tuding', 'perm', 'xa']","['hah', 'npantaskah', 'kita', 'diamkan', 'di', 'medan', 'demo', 'dukung', 'khilafah', 'tuding', 'perm', 'xa']",hah npantaskah diamkan medan demo dukung khilafah tuding perm,hah npantaskah diam medan demo dukung khilafah tuding perm,0,
933,b'RT @headlinebogor: Headline Nasional | KAMMI Tolak RUU TPKS dan Cabut Permendikbudristek PPKS -\nhttps://t.co/gfkVbXEetl\n#headlinebogor #kam\xe2\x80\xa6',b'rt @headlinebogor: headline nasional | kammi tolak ruu tpks dan cabut permendikbudristek ppks -\nhttps://t.co/gfkvbxeetl\n#headlinebogor #kam\xe2\x80\xa6', headline nasional kammi tolak ruu tpks dan cabut permendikbudristek ppks kam  xa,"['headline', 'nasional', 'kammi', 'tolak', 'ruu', 'tpks', 'dan', 'cabut', 'permendikbudristek', 'ppks', 'kam', 'xa']","['headline', 'nasional', 'kammi', 'tolak', 'ruu', 'tpks', 'dan', 'cabut', 'permendikbudristek', 'ppks', 'kam', 'xa']",headline nasional kammi tolak ruu tpks cabut permendikbudristek ppks kam,headline nasional kammi tolak ruu tpks cabut permendikbudristek ppks kam,0,
440,"b'RT @YogaAdrianyoga6: HTI dibubarkan, tapi underbow nya dibiarkan https://t.co/tB6TSkhmqD'","b'rt @yogaadrianyoga6: hti dibubarkan, tapi underbow nya dibiarkan https://t.co/tb6tskhmqd'", hti dibubarkan tapi underbow nya dibiarkan,"['hti', 'dibubarkan', 'tapi', 'underbow', 'nya', 'dibiarkan']","['hti', 'dibubarkan', 'tapi', 'underbow', 'nya', 'dibiarkan']",hti dibubarkan underbow nya dibiarkan,hti bubar underbow nya biar,,9
