,Tweets,Case_Folding,Data_Cleaning,Tokenize,Normalization,Stopwords,Stemming,Label,
11,b'RT @HopeHelpsNet: Permendikbud-Ristek PPKS menjelaskan langkah awal penciptaan ruang aman di lingkungan kampus. Gimana sih caranya nyiptain\xe2\x80\xa6',b'rt @hopehelpsnet: permendikbud-ristek ppks menjelaskan langkah awal penciptaan ruang aman di lingkungan kampus. gimana sih caranya nyiptain\xe2\x80\xa6', permendikbud ristek ppks menjelaskan langkah awal penciptaan ruang aman di lingkungan kampus gimana sih caranya nyiptain  xa,"['permendikbud', 'ristek', 'ppks', 'menjelaskan', 'langkah', 'awal', 'penciptaan', 'ruang', 'aman', 'di', 'lingkungan', 'kampus', 'gimana', 'sih', 'caranya', 'nyiptain', 'xa']","['permendikbud', 'ristek', 'ppks', 'menjelaskan', 'langkah', 'awal', 'penciptaan', 'ruang', 'aman', 'di', 'lingkungan', 'kampus', 'gimana', 'sih', 'caranya', 'nyiptain', 'xa']",permendikbud ristek ppks langkah penciptaan ruang aman lingkungan kampus gimana sih nyiptain,permendikbud ristek ppks langkah cipta ruang aman lingkung kampus gimana sih nyiptain,1,
267,"b'RT @dodhand: Permendikbud 30 thogut. \nTegakkan khilafah,"" kata orator aksi \nWoii .. nenek luh Pe\'ang \xe2\x80\xbc\xef\xb8\x8f\n\nhttps://t.co/HsBTJqnOuZ\n\nSejumlah\xe2\x80\xa6'","b'rt @dodhand: permendikbud 30 thogut. \ntegakkan khilafah,"" kata orator aksi \nwoii .. nenek luh pe\'ang \xe2\x80\xbc\xef\xb8\x8f\n\nhttps://t.co/hsbtjqnouz\n\nsejumlah\xe2\x80\xa6'", permendikbud thogut ntegakkan khilafah kata orator aksi nwoii nenek luh pe ang  xbc xef xb,"['permendikbud', 'thogut', 'ntegakkan', 'khilafah', 'kata', 'orator', 'aksi', 'nwoii', 'nenek', 'luh', 'pe', 'ang', 'xbc', 'xef', 'xb']","['permendikbud', 'thogut', 'ntegakkan', 'khilafah', 'kata', 'orator', 'aksi', 'nwoii', 'nenek', 'luh', 'pe', 'ang', 'xbc', 'xef', 'xb']",permendikbud thogut ntegakkan khilafah orator aksi nwoii nenek luh pe ang xbc xef xb,permendikbud thogut ntegakkan khilafah orator aksi nwoii nenek luh pe ang xbc xef xb,,9
542,b'RT @MbahTo581809: *[Diskusi Publik] PERMENDIKBUDRISTEK NO. 30 TAHUN 2021 : LEGALKAN SEKS BEBAS?*\n\nDengan alasan mencegah kekerasan seksual\xe2\x80\xa6',b'rt @mbahto581809: *[diskusi publik] permendikbudristek no. 30 tahun 2021 : legalkan seks bebas?*\n\ndengan alasan mencegah kekerasan seksual\xe2\x80\xa6', permendikbudristek no tahun legalkan seks bebas ndengan alasan mencegah kekerasan seksual  xa,"['permendikbudristek', 'no', 'tahun', 'legalkan', 'seks', 'bebas', 'ndengan', 'alasan', 'mencegah', 'kekerasan', 'seksual', 'xa']","['permendikbudristek', 'no', 'tahun', 'legalkan', 'seks', 'bebas', 'ndengan', 'alasan', 'mencegah', 'kekerasan', 'seksual', 'xa']",permendikbudristek no legalkan seks bebas ndengan alasan mencegah kekerasan seksual,permendikbudristek no legal seks bebas ndengan alas cegah keras seksual,0,
942,b'RT @IDNTimesSulsel: Permendikbudristek PPKS jadi acuan dan payung hukum https://t.co/A7W31dTLmf',b'rt @idntimessulsel: permendikbudristek ppks jadi acuan dan payung hukum https://t.co/a7w31dtlmf', permendikbudristek ppks jadi acuan dan payung hukum,"['permendikbudristek', 'ppks', 'jadi', 'acuan', 'dan', 'payung', 'hukum']","['permendikbudristek', 'ppks', 'jadi', 'acuan', 'dan', 'payung', 'hukum']",permendikbudristek ppks acuan payung hukum,permendikbudristek ppks acu payung hukum,1,
5426,"b'RT @onomsalam2pas: Permendikbudristek PPKS, Penyelewengan Terhadap Konstitusi?  https://t.co/SfAhbRYheB ; ?&gt;\nCovid-19\n20 November 2021\nAda\xe2\x80\xa6'","b'rt @onomsalam2pas: permendikbudristek ppks, penyelewengan terhadap konstitusi?  https://t.co/sfahbryheb ; ?&gt;\ncovid-19\n20 november 2021\nada\xe2\x80\xa6'", permendikbudristek ppks penyelewengan terhadap konstitusi gt ncovid november nada  xa,"['permendikbudristek', 'ppks', 'penyelewengan', 'terhadap', 'konstitusi', 'gt', 'ncovid', 'november', 'nada', 'xa']","['permendikbudristek', 'ppks', 'penyelewengan', 'terhadap', 'konstitusi', 'gt', 'ncovid', 'november', 'nada', 'xa']",permendikbudristek ppks penyelewengan konstitusi gt ncovid november nada,permendikbudristek ppks seleweng konstitusi gt ncovid november nada,0,
5315,b'RT @M3juahjuah: PermendikbudRistek PPKS untuk cegah kekerasan seksual.\n\nKH Husein Muhammad katakan Permendikbudristek PPKS ini penting.\nBel\xe2\x80\xa6',b'rt @m3juahjuah: permendikbudristek ppks untuk cegah kekerasan seksual.\n\nkh husein muhammad katakan permendikbudristek ppks ini penting.\nbel\xe2\x80\xa6', permendikbudristek ppks untuk cegah kekerasan seksual nkh husein muhammad katakan permendikbudristek ppks ini penting nbel  xa,"['permendikbudristek', 'ppks', 'untuk', 'cegah', 'kekerasan', 'seksual', 'nkh', 'husein', 'muhammad', 'katakan', 'permendikbudristek', 'ppks', 'ini', 'penting', 'nbel', 'xa']","['permendikbudristek', 'ppks', 'untuk', 'cegah', 'kekerasan', 'seksual', 'nkh', 'husein', 'muhammad', 'katakan', 'permendikbudristek', 'ppks', 'ini', 'penting', 'nbel', 'xa']",permendikbudristek ppks cegah kekerasan seksual nkh husein muhammad permendikbudristek ppks nbel,permendikbudristek ppks cegah keras seksual nkh husein muhammad permendikbudristek ppks nbel,1,
1073,"b'RT @kompasiana: PPKS, Setetes Air di Tengah Gurun Kekerasan Seksual Tersembunyi Kampus https://t.co/jg1v2rsbqH'","b'rt @kompasiana: ppks, setetes air di tengah gurun kekerasan seksual tersembunyi kampus https://t.co/jg1v2rsbqh'", ppks setetes air di tengah gurun kekerasan seksual tersembunyi kampus,"['ppks', 'setetes', 'air', 'di', 'tengah', 'gurun', 'kekerasan', 'seksual', 'tersembunyi', 'kampus']","['ppks', 'setetes', 'air', 'di', 'tengah', 'gurun', 'kekerasan', 'seksual', 'tersembunyi', 'kampus']",ppks setetes air gurun kekerasan seksual tersembunyi kampus,ppks tetes air gurun keras seksual sembunyi kampus,1,
910,b'RT @CNNIndonesia: Pro Kontra Permendikbud PPKS di Tengah Pandemi https://t.co/VpjKzI60Vt',b'rt @cnnindonesia: pro kontra permendikbud ppks di tengah pandemi https://t.co/vpjkzi60vt', pro kontra permendikbud ppks di tengah pandemi,"['pro', 'kontra', 'permendikbud', 'ppks', 'di', 'tengah', 'pandemi']","['pro', 'kontra', 'permendikbud', 'ppks', 'di', 'tengah', 'pandemi']",pro kontra permendikbud ppks pandemi,pro kontra permendikbud ppks pandemi,,9
957,b'RT @detikcom: Ratusan mahasiswa menggelar aksi demo di Kemendikbud menuntut pencabutan permendikbud no 30 tahun 2021 tentang Pencegahan dan\xe2\x80\xa6',b'rt @detikcom: ratusan mahasiswa menggelar aksi demo di kemendikbud menuntut pencabutan permendikbud no 30 tahun 2021 tentang pencegahan dan\xe2\x80\xa6', ratusan mahasiswa menggelar aksi demo di kemendikbud menuntut pencabutan permendikbud no tahun tentang pencegahan dan  xa,"['ratusan', 'mahasiswa', 'menggelar', 'aksi', 'demo', 'di', 'kemendikbud', 'menuntut', 'pencabutan', 'permendikbud', 'no', 'tahun', 'tentang', 'pencegahan', 'dan', 'xa']","['ratusan', 'mahasiswa', 'menggelar', 'aksi', 'demo', 'di', 'kemendikbud', 'menuntut', 'pencabutan', 'permendikbud', 'no', 'tahun', 'tentang', 'pencegahan', 'dan', 'xa']",ratusan mahasiswa menggelar aksi demo kemendikbud menuntut pencabutan permendikbud no pencegahan,ratus mahasiswa gelar aksi demo kemendikbud tuntut cabut permendikbud no cegah,0,
5398,"b'RT @fordoyoungkim: RUU PPKS diabaikan, Permendikbud 30 di kritik habis-habisan. Segitu gamaunya ngelindungin hak-hak perempuan? As if these\xe2\x80\xa6'","b'rt @fordoyoungkim: ruu ppks diabaikan, permendikbud 30 di kritik habis-habisan. segitu gamaunya ngelindungin hak-hak perempuan? as if these\xe2\x80\xa6'", ruu ppks diabaikan permendikbud di kritik habis habisan segitu gamaunya ngelindungin hak hak perempuan as if these  xa,"['ruu', 'ppks', 'diabaikan', 'permendikbud', 'di', 'kritik', 'habis', 'habisan', 'segitu', 'gamaunya', 'ngelindungin', 'hak', 'hak', 'perempuan', 'as', 'if', 'these', 'xa']","['ruu', 'ppks', 'diabaikan', 'permendikbud', 'di', 'kritik', 'habis', 'habisan', 'segitu', 'gamaunya', 'ngelindungin', 'hak', 'hak', 'perempuan', 'as', 'if', 'these', 'xa']",ruu ppks diabaikan permendikbud kritik habis habisan segitu gamaunya ngelindungin hak hak perempuan as if these,ruu ppks abai permendikbud kritik habis habis segitu gamaunya ngelindungin hak hak perempuan as if these,0,
5383,"b'RT @tifsembiring: Sebenarnya saat RUU PKS diajukan, poin2 yg mengarah kpd \xe2\x80\x98sexual consent\xe2\x80\x99 ini sangat dikritik tokoh2 masyarakat, sbg boleh\xe2\x80\xa6'","b'rt @tifsembiring: sebenarnya saat ruu pks diajukan, poin2 yg mengarah kpd \xe2\x80\x98sexual consent\xe2\x80\x99 ini sangat dikritik tokoh2 masyarakat, sbg boleh\xe2\x80\xa6'", sebenarnya saat ruu pks diajukan poin yg mengarah kpd  sexual consent  ini sangat dikritik tokoh masyarakat sbg boleh  xa,"['sebenarnya', 'saat', 'ruu', 'pks', 'diajukan', 'poin', 'yg', 'mengarah', 'kpd', 'sexual', 'consent', 'ini', 'sangat', 'dikritik', 'tokoh', 'masyarakat', 'sbg', 'boleh', 'xa']","['sebenarnya', 'saat', 'ruu', 'pks', 'diajukan', 'poin', 'yg', 'mengarah', 'kpd', 'sexual', 'consent', 'ini', 'sangat', 'dikritik', 'tokoh', 'masyarakat', 'sbg', 'boleh', 'xa']",ruu pks diajukan poin yg mengarah kpd sexual consent dikritik tokoh masyarakat sbg,ruu pks aju poin yg arah kpd sexual consent kritik tokoh masyarakat sbg,,9
5371,"b'RT @GunRomli: Seenaknya nuduh2 ""legalisasi perzinahan/free sex"" setelah dituding balik: hanya penjahat-penjahat kelamin krn menolak Permend\xe2\x80\xa6'","b'rt @gunromli: seenaknya nuduh2 ""legalisasi perzinahan/free sex"" setelah dituding balik: hanya penjahat-penjahat kelamin krn menolak permend\xe2\x80\xa6'", seenaknya nuduh legalisasi perzinahan free sex setelah dituding balik hanya penjahat penjahat kelamin krn menolak permend  xa,"['seenaknya', 'nuduh', 'legalisasi', 'perzinahan', 'free', 'sex', 'setelah', 'dituding', 'balik', 'hanya', 'penjahat', 'penjahat', 'kelamin', 'krn', 'menolak', 'permend', 'xa']","['seenaknya', 'nuduh', 'legalisasi', 'perzinahan', 'free', 'sex', 'setelah', 'dituding', 'balik', 'hanya', 'penjahat', 'penjahat', 'kelamin', 'krn', 'menolak', 'permend', 'xa']",nuduh legalisasi perzinahan free sex dituding penjahat penjahat kelamin krn menolak permend,nuduh legalisasi perzinahan free sex tuding jahat jahat kelamin krn tolak permend,0,
132,"b'RT @rudysarwa: Seharusnya mahasiswa yg mana punya akses pendidikan tinggi, seharusnya lebih uptodate pada science moderen.\nTapi mahsiswa ki\xe2\x80\xa6'","b'rt @rudysarwa: seharusnya mahasiswa yg mana punya akses pendidikan tinggi, seharusnya lebih uptodate pada science moderen.\ntapi mahsiswa ki\xe2\x80\xa6'", seharusnya mahasiswa yg mana punya akses pendidikan tinggi seharusnya lebih uptodate pada science moderen ntapi mahsiswa ki  xa,"['seharusnya', 'mahasiswa', 'yg', 'mana', 'punya', 'akses', 'pendidikan', 'tinggi', 'seharusnya', 'lebih', 'uptodate', 'pada', 'science', 'moderen', 'ntapi', 'mahsiswa', 'ki', 'xa']","['seharusnya', 'mahasiswa', 'yg', 'mana', 'punya', 'akses', 'pendidikan', 'tinggi', 'seharusnya', 'lebih', 'uptodate', 'pada', 'science', 'moderen', 'ntapi', 'mahsiswa', 'ki', 'xa']",mahasiswa yg akses pendidikan uptodate science moderen ntapi mahsiswa ki,mahasiswa yg akses didik uptodate science moderen ntapi mahsiswa ki,1,
1454,"b'RT @a_cinderakasih: Sejak pertengahan tahun dan sebelum permendikbud ppks, di kampus udah ada delik aduan. Meski enggak spesifik untuk keke\xe2\x80\xa6'","b'rt @a_cinderakasih: sejak pertengahan tahun dan sebelum permendikbud ppks, di kampus udah ada delik aduan. meski enggak spesifik untuk keke\xe2\x80\xa6'", sejak pertengahan tahun dan sebelum permendikbud ppks di kampus udah ada delik aduan meski enggak spesifik untuk keke  xa,"['sejak', 'pertengahan', 'tahun', 'dan', 'sebelum', 'permendikbud', 'ppks', 'di', 'kampus', 'udah', 'ada', 'delik', 'aduan', 'meski', 'enggak', 'spesifik', 'untuk', 'keke', 'xa']","['sejak', 'pertengahan', 'tahun', 'dan', 'sebelum', 'permendikbud', 'ppks', 'di', 'kampus', 'udah', 'ada', 'delik', 'aduan', 'meski', 'enggak', 'spesifik', 'untuk', 'keke', 'xa']",pertengahan permendikbud ppks kampus udah delik aduan spesifik keke,tengah permendikbud ppks kampus udah delik adu spesifik keke,1,
853,b'RT @detikcom: Sejumlah mahasiswa menggelar demonstrasi di Medan. Mereka meminta Permendikbudr PPKS di Lingkungan Perguruan Tinggi dicabut.\xe2\x80\xa6',b'rt @detikcom: sejumlah mahasiswa menggelar demonstrasi di medan. mereka meminta permendikbudr ppks di lingkungan perguruan tinggi dicabut.\xe2\x80\xa6', sejumlah mahasiswa menggelar demonstrasi di medan mereka meminta permendikbudr ppks di lingkungan perguruan tinggi dicabut  xa,"['sejumlah', 'mahasiswa', 'menggelar', 'demonstrasi', 'di', 'medan', 'mereka', 'meminta', 'permendikbudr', 'ppks', 'di', 'lingkungan', 'perguruan', 'tinggi', 'dicabut', 'xa']","['sejumlah', 'mahasiswa', 'menggelar', 'demonstrasi', 'di', 'medan', 'mereka', 'meminta', 'permendikbudr', 'ppks', 'di', 'lingkungan', 'perguruan', 'tinggi', 'dicabut', 'xa']",mahasiswa menggelar demonstrasi medan permendikbudr ppks lingkungan perguruan dicabut,mahasiswa gelar demonstrasi medan permendikbudr ppks lingkung guru cabut,0,
747,"b'RT @GunRomli: Selain penjahat kelamin, penolak Permendikbudristek PPKS ini juga pendukung Khilafah!\n\nGema Pembebasan itu sayap Hizbut Tahri\xe2\x80\xa6'","b'rt @gunromli: selain penjahat kelamin, penolak permendikbudristek ppks ini juga pendukung khilafah!\n\ngema pembebasan itu sayap hizbut tahri\xe2\x80\xa6'", selain penjahat kelamin penolak permendikbudristek ppks ini juga pendukung khilafah ngema pembebasan itu sayap hizbut tahri  xa,"['selain', 'penjahat', 'kelamin', 'penolak', 'permendikbudristek', 'ppks', 'ini', 'juga', 'pendukung', 'khilafah', 'ngema', 'pembebasan', 'itu', 'sayap', 'hizbut', 'tahri', 'xa']","['selain', 'penjahat', 'kelamin', 'penolak', 'permendikbudristek', 'ppks', 'ini', 'juga', 'pendukung', 'khilafah', 'ngema', 'pembebasan', 'itu', 'sayap', 'hizbut', 'tahri', 'xa']",penjahat kelamin penolak permendikbudristek ppks pendukung khilafah ngema pembebasan sayap hizbut tahri,jahat kelamin tolak permendikbudristek ppks dukung khilafah ngema bebas sayap hizbut tahri,0,
5431,"b'RT @kompascom: Sesungguhnya, pernikahan dini juga menjadi bahaya tersembunyi di tengah kehebohan polemik Permendikbud PPKS. https://t.co/6R\xe2\x80\xa6'","b'rt @kompascom: sesungguhnya, pernikahan dini juga menjadi bahaya tersembunyi di tengah kehebohan polemik permendikbud ppks. https://t.co/6r\xe2\x80\xa6'", sesungguhnya pernikahan dini juga menjadi bahaya tersembunyi di tengah kehebohan polemik permendikbud ppks,"['sesungguhnya', 'pernikahan', 'dini', 'juga', 'menjadi', 'bahaya', 'tersembunyi', 'di', 'tengah', 'kehebohan', 'polemik', 'permendikbud', 'ppks']","['sesungguhnya', 'pernikahan', 'dini', 'juga', 'menjadi', 'bahaya', 'tersembunyi', 'di', 'tengah', 'kehebohan', 'polemik', 'permendikbud', 'ppks']",sesungguhnya pernikahan bahaya tersembunyi kehebohan polemik permendikbud ppks,sungguh nikah bahaya sembunyi heboh polemik permendikbud ppks,,9
3776,"b'RT @catchmeupid: Setelah menuai pro dan kontra, Permendikbud PPKS udah resmi berlaku nih gengs. \n\nMakin ke sini, ternyata makin banyak korb\xe2\x80\xa6'","b'rt @catchmeupid: setelah menuai pro dan kontra, permendikbud ppks udah resmi berlaku nih gengs. \n\nmakin ke sini, ternyata makin banyak korb\xe2\x80\xa6'", setelah menuai pro dan kontra permendikbud ppks udah resmi berlaku nih gengs nmakin ke sini ternyata makin banyak korb  xa,"['setelah', 'menuai', 'pro', 'dan', 'kontra', 'permendikbud', 'ppks', 'udah', 'resmi', 'berlaku', 'nih', 'gengs', 'nmakin', 'ke', 'sini', 'ternyata', 'makin', 'banyak', 'korb', 'xa']","['setelah', 'menuai', 'pro', 'dan', 'kontra', 'permendikbud', 'ppks', 'udah', 'resmi', 'berlaku', 'nih', 'gengs', 'nmakin', 'ke', 'sini', 'ternyata', 'makin', 'banyak', 'korb', 'xa']",menuai pro kontra permendikbud ppks udah resmi berlaku nih gengs nmakin korb,tuai pro kontra permendikbud ppks udah resmi laku nih gengs nmakin korb,1,
685,"b'RT @cagubnyinyir2: TALIBAN DI MEDAN !\nMahasiswa Demo di Kantor DPRD Sumut Medan  Dukung Khilafah, Tuding Permendikbud 30 PPKS Thogut"", bawa\xe2\x80\xa6'","b'rt @cagubnyinyir2: taliban di medan !\nmahasiswa demo di kantor dprd sumut medan  dukung khilafah, tuding permendikbud 30 ppks thogut"", bawa\xe2\x80\xa6'", taliban di medan nmahasiswa demo di kantor dprd sumut medan dukung khilafah tuding permendikbud ppks thogut bawa  xa,"['taliban', 'di', 'medan', 'nmahasiswa', 'demo', 'di', 'kantor', 'dprd', 'sumut', 'medan', 'dukung', 'khilafah', 'tuding', 'permendikbud', 'ppks', 'thogut', 'bawa', 'xa']","['taliban', 'di', 'medan', 'nmahasiswa', 'demo', 'di', 'kantor', 'dprd', 'sumut', 'medan', 'dukung', 'khilafah', 'tuding', 'permendikbud', 'ppks', 'thogut', 'bawa', 'xa']",taliban medan nmahasiswa demo kantor dprd sumut medan dukung khilafah tuding permendikbud ppks thogut bawa,talib medan nmahasiswa demo kantor dprd sumut medan dukung khilafah tuding permendikbud ppks thogut bawa,0,
5425,b'RT @MMC_IDN2: [Muslimah talk] Terbitnya Permendikbud No. 30 Thn 2021 tentang Pencegahan &amp; Penanganan Kekerasan Seksual  (PPKS) dipandang se\xe2\x80\xa6',b'rt @mmc_idn2: [muslimah talk] terbitnya permendikbud no. 30 thn 2021 tentang pencegahan &amp; penanganan kekerasan seksual  (ppks) dipandang se\xe2\x80\xa6', terbitnya permendikbud no thn tentang pencegahan amp penanganan kekerasan seksual ppks dipandang se  xa,"['terbitnya', 'permendikbud', 'no', 'thn', 'tentang', 'pencegahan', 'amp', 'penanganan', 'kekerasan', 'seksual', 'ppks', 'dipandang', 'se', 'xa']","['terbitnya', 'permendikbud', 'no', 'thn', 'tentang', 'pencegahan', 'amp', 'penanganan', 'kekerasan', 'seksual', 'ppks', 'dipandang', 'se', 'xa']",terbitnya permendikbud no thn pencegahan amp penanganan kekerasan seksual ppks dipandang,terbit permendikbud no thn cegah amp tangan keras seksual ppks pandang,1,
960,b'RT @IDNTimesNTB: Tim satgas pencegahan PPKS diisi 50 persen dari mahasiswa https://t.co/QXBYNwWSMi',b'rt @idntimesntb: tim satgas pencegahan ppks diisi 50 persen dari mahasiswa https://t.co/qxbynwwsmi', tim satgas pencegahan ppks diisi persen dari mahasiswa,"['tim', 'satgas', 'pencegahan', 'ppks', 'diisi', 'persen', 'dari', 'mahasiswa']","['tim', 'satgas', 'pencegahan', 'ppks', 'diisi', 'persen', 'dari', 'mahasiswa']",tim satgas pencegahan ppks diisi persen mahasiswa,tim satgas cegah ppks isi persen mahasiswa,1,
974,"b'RT @arusbaik_id: Yes! Permendikbud Ristek PPKS, Panen Dukungan Dari Semua Kalangan \n#ArusBaik \n#kekerasanseksual \n#pemerintah \nhttps://t.co\xe2\x80\xa6'","b'rt @arusbaik_id: yes! permendikbud ristek ppks, panen dukungan dari semua kalangan \n#arusbaik \n#kekerasanseksual \n#pemerintah \nhttps://t.co\xe2\x80\xa6'", yes permendikbud ristek ppks panen dukungan dari semua kalangan arusbaik kekerasanseksual pemerintah,"['yes', 'permendikbud', 'ristek', 'ppks', 'panen', 'dukungan', 'dari', 'semua', 'kalangan', 'arusbaik', 'kekerasanseksual', 'pemerintah']","['yes', 'permendikbud', 'ristek', 'ppks', 'panen', 'dukungan', 'dari', 'semua', 'kalangan', 'arusbaik', 'kekerasanseksual', 'pemerintah']",yes permendikbud ristek ppks panen dukungan kalangan arusbaik kekerasanseksual pemerintah,yes permendikbud ristek ppks panen dukung kalang arusbaik kekerasanseksual perintah,1,
653,b'RT @Utara99912: Yth. Menkopolhukam @mohmahfudmd \n        Mendikbudristek @nadiemmakarim \n\nhttps://t.co/A8AIWLzqy6\n\nKita tentu tidak sedang\xe2\x80\xa6',b'rt @utara99912: yth. menkopolhukam @mohmahfudmd \n        mendikbudristek @nadiemmakarim \n\nhttps://t.co/a8aiwlzqy6\n\nkita tentu tidak sedang\xe2\x80\xa6', yth menkopolhukam mendikbudristek tentu tidak sedang  xa,"['yth', 'menkopolhukam', 'mendikbudristek', 'tentu', 'tidak', 'sedang', 'xa']","['yth', 'menkopolhukam', 'mendikbudristek', 'tentu', 'tidak', 'sedang', 'xa']",yth menkopolhukam mendikbudristek,yth menkopolhukam mendikbudristek,0,
5404,"b'ada yang udah baca isi permendikbud no.30 tentang PPKS ? kalau ada boleh dong dm, butuh temen diskusi buat bikin kajian, thank you.'","b'ada yang udah baca isi permendikbud no.30 tentang ppks ? kalau ada boleh dong dm, butuh temen diskusi buat bikin kajian, thank you.'",ada yang udah baca isi permendikbud no tentang ppks kalau ada boleh dong dm butuh temen diskusi buat bikin kajian thank you,"['ada', 'yang', 'udah', 'baca', 'isi', 'permendikbud', 'no', 'tentang', 'ppks', 'kalau', 'ada', 'boleh', 'dong', 'dm', 'butuh', 'temen', 'diskusi', 'buat', 'bikin', 'kajian', 'thank', 'you']","['ada', 'yang', 'udah', 'baca', 'isi', 'permendikbud', 'no', 'tentang', 'ppks', 'kalau', 'ada', 'boleh', 'dong', 'dm', 'butuh', 'temen', 'diskusi', 'buat', 'bikin', 'kajian', 'thank', 'you']",udah baca isi permendikbud no ppks dm butuh temen diskusi bikin kajian thank you,udah baca isi permendikbud no ppks dm butuh temen diskusi bikin kaji thank you,,9
38,"b'Aksi Tolak Permen PPKS, Cegah Perzinaan dengan Syariah | Serba-serbi MMC\n\nhttps://t.co/OgEYJX0cRG https://t.co/YcPmj64r1C'","b'aksi tolak permen ppks, cegah perzinaan dengan syariah | serba-serbi mmc\n\nhttps://t.co/ogeyjx0crg https://t.co/ycpmj64r1c'",aksi tolak permen ppks cegah perzinaan dengan syariah serba serbi mmc,"['aksi', 'tolak', 'permen', 'ppks', 'cegah', 'perzinaan', 'dengan', 'syariah', 'serba', 'serbi', 'mmc']","['aksi', 'tolak', 'permen', 'ppks', 'cegah', 'perzinaan', 'dengan', 'syariah', 'serba', 'serbi', 'mmc']",aksi tolak permen ppks cegah perzinaan syariah serba serbi mmc,aksi tolak permen ppks cegah zina syariah serba serbi mmc,0,
44,"b'Aksi Tolak Permen PPKS, Cegah Perzinaan dengan Syariah | Serba-serbi MMC\n\n Apa saja yang disampaikan dalam aksi kem\xe2\x80\xa6 https://t.co/RtAHY1CpjK'","b'aksi tolak permen ppks, cegah perzinaan dengan syariah | serba-serbi mmc\n\n apa saja yang disampaikan dalam aksi kem\xe2\x80\xa6 https://t.co/rtahy1cpjk'",aksi tolak permen ppks cegah perzinaan dengan syariah serba serbi mmc apa saja yang disampaikan dalam aksi kem  xa,"['aksi', 'tolak', 'permen', 'ppks', 'cegah', 'perzinaan', 'dengan', 'syariah', 'serba', 'serbi', 'mmc', 'apa', 'saja', 'yang', 'disampaikan', 'dalam', 'aksi', 'kem', 'xa']","['aksi', 'tolak', 'permen', 'ppks', 'cegah', 'perzinaan', 'dengan', 'syariah', 'serba', 'serbi', 'mmc', 'apa', 'saja', 'yang', 'disampaikan', 'dalam', 'aksi', 'kem', 'xa']",aksi tolak permen ppks cegah perzinaan syariah serba serbi mmc aksi kem,aksi tolak permen ppks cegah zina syariah serba serbi mmc aksi kem,0,
74,"b'Aksi Tolak Permen PPKS, Cegah Perzinaan dengan Syariah | Serba-serbi MMC\n\nhttps://t.co/hsulR67fsL\n\nJangan lupa shar\xe2\x80\xa6 https://t.co/u3dXa7UvjZ'","b'aksi tolak permen ppks, cegah perzinaan dengan syariah | serba-serbi mmc\n\nhttps://t.co/hsulr67fsl\n\njangan lupa shar\xe2\x80\xa6 https://t.co/u3dxa7uvjz'",aksi tolak permen ppks cegah perzinaan dengan syariah serba serbi mmc lupa shar  xa,"['aksi', 'tolak', 'permen', 'ppks', 'cegah', 'perzinaan', 'dengan', 'syariah', 'serba', 'serbi', 'mmc', 'lupa', 'shar', 'xa']","['aksi', 'tolak', 'permen', 'ppks', 'cegah', 'perzinaan', 'dengan', 'syariah', 'serba', 'serbi', 'mmc', 'lupa', 'shar', 'xa']",aksi tolak permen ppks cegah perzinaan syariah serba serbi mmc lupa shar,aksi tolak permen ppks cegah zina syariah serba serbi mmc lupa shar,0,
99,"b'Aksi Tolak Permen PPKS, Cegah Perzinaan dengan Syariah | Serba-serbi MMC\n\nApa saja yang disampaikan dalam aksi kema\xe2\x80\xa6 https://t.co/YHV2Gwx8T0'","b'aksi tolak permen ppks, cegah perzinaan dengan syariah | serba-serbi mmc\n\napa saja yang disampaikan dalam aksi kema\xe2\x80\xa6 https://t.co/yhv2gwx8t0'",aksi tolak permen ppks cegah perzinaan dengan syariah serba serbi mmc napa saja yang disampaikan dalam aksi kema  xa,"['aksi', 'tolak', 'permen', 'ppks', 'cegah', 'perzinaan', 'dengan', 'syariah', 'serba', 'serbi', 'mmc', 'napa', 'saja', 'yang', 'disampaikan', 'dalam', 'aksi', 'kema', 'xa']","['aksi', 'tolak', 'permen', 'ppks', 'cegah', 'perzinaan', 'dengan', 'syariah', 'serba', 'serbi', 'mmc', 'napa', 'saja', 'yang', 'disampaikan', 'dalam', 'aksi', 'kema', 'xa']",aksi tolak permen ppks cegah perzinaan syariah serba serbi mmc napa aksi kema,aksi tolak permen ppks cegah zina syariah serba serbi mmc napa aksi kema,0,
103,"b'Aksi Tolak Permen PPKS, Cegah Perzinaan dengan Syariah | Serba-serbi MMC\n\nSebagai bentuk reaksi atas disahkannya Pe\xe2\x80\xa6 https://t.co/JVVQU2SSVS'","b'aksi tolak permen ppks, cegah perzinaan dengan syariah | serba-serbi mmc\n\nsebagai bentuk reaksi atas disahkannya pe\xe2\x80\xa6 https://t.co/jvvqu2ssvs'",aksi tolak permen ppks cegah perzinaan dengan syariah serba serbi mmc nsebagai bentuk reaksi atas disahkannya pe  xa,"['aksi', 'tolak', 'permen', 'ppks', 'cegah', 'perzinaan', 'dengan', 'syariah', 'serba', 'serbi', 'mmc', 'nsebagai', 'bentuk', 'reaksi', 'atas', 'disahkannya', 'pe', 'xa']","['aksi', 'tolak', 'permen', 'ppks', 'cegah', 'perzinaan', 'dengan', 'syariah', 'serba', 'serbi', 'mmc', 'nsebagai', 'bentuk', 'reaksi', 'atas', 'disahkannya', 'pe', 'xa']",aksi tolak permen ppks cegah perzinaan syariah serba serbi mmc nsebagai bentuk reaksi disahkannya pe,aksi tolak permen ppks cegah zina syariah serba serbi mmc nsebagai bentuk reaksi sah pe,0,
