,Tweets,Case_Folding,Data_Cleaning,Tokenize,Normalization,Stopwords,Stemming,Label,
930,b'[PERMENDIKBUD-RISTEK NO 30 TAHUN 2021 SEBAGAI SOLUSI DARI FENOMENA KEKERASAN SEKSUAL DI PERGURUAN TINGGI]\n\nMenteri\xe2\x80\xa6 https://t.co/OkD2idZQmM',b'[permendikbud-ristek no 30 tahun 2021 sebagai solusi dari fenomena kekerasan seksual di perguruan tinggi]\n\nmenteri\xe2\x80\xa6 https://t.co/okd2idzqmm',nmenteri  xa,"['nmenteri', 'xa']","['nmenteri', 'xa']",nmenteri,nmenteri,,9
4135,"b'[MISKONSEPSI PERMENDIKBUDRISTEK PPKS]\n\nPeraturan Menteri Pendidikan, Kebudayaan, Riset dan Teknologi (Permendikbudr\xe2\x80\xa6 https://t.co/dkVKvCVdGH'","b'[miskonsepsi permendikbudristek ppks]\n\nperaturan menteri pendidikan, kebudayaan, riset dan teknologi (permendikbudr\xe2\x80\xa6 https://t.co/dkvkvcvdgh'",nperaturan menteri pendidikan kebudayaan riset dan teknologi permendikbudr  xa,"['nperaturan', 'menteri', 'pendidikan', 'kebudayaan', 'riset', 'dan', 'teknologi', 'permendikbudr', 'xa']","['nperaturan', 'menteri', 'pendidikan', 'kebudayaan', 'riset', 'dan', 'teknologi', 'permendikbudr', 'xa']",nperaturan menteri pendidikan kebudayaan riset teknologi permendikbudr,nperaturan menteri didik budaya riset teknologi permendikbudr,0,
1237,b'[DENGAR SUARA MAHASISWA]\n\nSejak Kemdikbudristek mengesahkan Permen PPKS banyak perdebatan yang muncul. Terdapat pih\xe2\x80\xa6 https://t.co/umi1bxxGPB',b'[dengar suara mahasiswa]\n\nsejak kemdikbudristek mengesahkan permen ppks banyak perdebatan yang muncul. terdapat pih\xe2\x80\xa6 https://t.co/umi1bxxgpb',nsejak kemdikbudristek mengesahkan permen ppks banyak perdebatan yang muncul terdapat pih  xa,"['nsejak', 'kemdikbudristek', 'mengesahkan', 'permen', 'ppks', 'banyak', 'perdebatan', 'yang', 'muncul', 'terdapat', 'pih', 'xa']","['nsejak', 'kemdikbudristek', 'mengesahkan', 'permen', 'ppks', 'banyak', 'perdebatan', 'yang', 'muncul', 'terdapat', 'pih', 'xa']",nsejak kemdikbudristek mengesahkan permen ppks perdebatan muncul pih,nsejak kemdikbudristek kesah permen ppks debat muncul pih,0,
5269,b'[BERITA] \n\nStatuta UI dan Permendikbud Ristek tentang PPKS dalam Eksplorasi Calon MWA UI UM 2022 \n\nSelengkapnya dap\xe2\x80\xa6 https://t.co/ExYrXmkLde',b'[berita] \n\nstatuta ui dan permendikbud ristek tentang ppks dalam eksplorasi calon mwa ui um 2022 \n\nselengkapnya dap\xe2\x80\xa6 https://t.co/exyrxmklde',nstatuta ui dan permendikbud ristek tentang ppks dalam eksplorasi calon mwa ui um nselengkapnya dap  xa,"['nstatuta', 'ui', 'dan', 'permendikbud', 'ristek', 'tentang', 'ppks', 'dalam', 'eksplorasi', 'calon', 'mwa', 'ui', 'um', 'nselengkapnya', 'dap', 'xa']","['nstatuta', 'ui', 'dan', 'permendikbud', 'ristek', 'tentang', 'ppks', 'dalam', 'eksplorasi', 'calon', 'mwa', 'ui', 'um', 'nselengkapnya', 'dap', 'xa']",nstatuta ui permendikbud ristek ppks eksplorasi calon mwa ui um nselengkapnya dap,nstatuta ui permendikbud ristek ppks eksplorasi calon mwa ui um nselengkapnya dap,,9
5293,"b'#Opini\n\nPermen PPKS: Menuju Kampus \xe2\x80\x9cBebas Merdeka\xe2\x80\x9d (?)\n\nPeraturan Menteri Pendidikan, Kebudayaan, Riset, dan Teknol\xe2\x80\xa6 https://t.co/am5hCuaJZo'","b'#opini\n\npermen ppks: menuju kampus \xe2\x80\x9cbebas merdeka\xe2\x80\x9d (?)\n\nperaturan menteri pendidikan, kebudayaan, riset, dan teknol\xe2\x80\xa6 https://t.co/am5hcuajzo'",opini npermen ppks menuju kampus  cbebas merdeka  nperaturan menteri pendidikan kebudayaan riset dan teknol  xa,"['opini', 'npermen', 'ppks', 'menuju', 'kampus', 'cbebas', 'merdeka', 'nperaturan', 'menteri', 'pendidikan', 'kebudayaan', 'riset', 'dan', 'teknol', 'xa']","['opini', 'npermen', 'ppks', 'menuju', 'kampus', 'cbebas', 'merdeka', 'nperaturan', 'menteri', 'pendidikan', 'kebudayaan', 'riset', 'dan', 'teknol', 'xa']",opini npermen ppks kampus cbebas merdeka nperaturan menteri pendidikan kebudayaan riset teknol,opini npermen ppks kampus cbebas merdeka nperaturan menteri didik budaya riset teknol,1,
133,"b'Opini Saya Tentang UU PPKS, Mas Menteri Sudah Benar https://t.co/T3kZWSMucP'","b'opini saya tentang uu ppks, mas menteri sudah benar https://t.co/t3kzwsmucp'",opini saya tentang uu ppks mas menteri sudah benar,"['opini', 'saya', 'tentang', 'uu', 'ppks', 'mas', 'menteri', 'sudah', 'benar']","['opini', 'saya', 'tentang', 'uu', 'ppks', 'mas', 'menteri', 'sudah', 'benar']",opini uu ppks mas menteri,opini uu ppks mas menteri,1,
1754,"b""padahal hari ini dapet kabar baik. unsika udah bentuk pansel ppks :')""","b""padahal hari ini dapet kabar baik. unsika udah bentuk pansel ppks :')""",padahal hari ini dapet kabar baik unsika udah bentuk pansel ppks,"['padahal', 'hari', 'ini', 'dapet', 'kabar', 'baik', 'unsika', 'udah', 'bentuk', 'pansel', 'ppks']","['padahal', 'hari', 'ini', 'dapet', 'kabar', 'baik', 'unsika', 'udah', 'bentuk', 'pansel', 'ppks']",dapet kabar unsika udah bentuk pansel ppks,dapet kabar unsika udah bentuk pansel ppks,1,
5387,b'Pahami dengan seksama Permendikbudristek 30/2021 Tentang PPKS. Jika seseorang melakukan tindakan yang bernuansa kek\xe2\x80\xa6 https://t.co/AXdB8GLr8i',b'pahami dengan seksama permendikbudristek 30/2021 tentang ppks. jika seseorang melakukan tindakan yang bernuansa kek\xe2\x80\xa6 https://t.co/axdb8glr8i',pahami dengan seksama permendikbudristek tentang ppks jika seseorang melakukan tindakan yang bernuansa kek  xa,"['pahami', 'dengan', 'seksama', 'permendikbudristek', 'tentang', 'ppks', 'jika', 'seseorang', 'melakukan', 'tindakan', 'yang', 'bernuansa', 'kek', 'xa']","['pahami', 'dengan', 'seksama', 'permendikbudristek', 'tentang', 'ppks', 'jika', 'seseorang', 'melakukan', 'tindakan', 'yang', 'bernuansa', 'kek', 'xa']",pahami seksama permendikbudristek ppks tindakan bernuansa kek,paham seksama permendikbudristek ppks tindak nuansa kek,1,
815,"b'@mohmahfudmd Pak Mahfud, pemerintah sudah membubarkan HTI, tapi koq mereka (Gema Pembebasan, organisasi sayap HTI)\xe2\x80\xa6 https://t.co/0u8EV9AEqi'","b'@mohmahfudmd pak mahfud, pemerintah sudah membubarkan hti, tapi koq mereka (gema pembebasan, organisasi sayap hti)\xe2\x80\xa6 https://t.co/0u8ev9aeqi'",pak mahfud pemerintah sudah membubarkan hti tapi koq mereka gema pembebasan organisasi sayap hti  xa,"['pak', 'mahfud', 'pemerintah', 'sudah', 'membubarkan', 'hti', 'tapi', 'koq', 'mereka', 'gema', 'pembebasan', 'organisasi', 'sayap', 'hti', 'xa']","['pak', 'mahfud', 'pemerintah', 'sudah', 'membubarkan', 'hti', 'tapi', 'koq', 'mereka', 'gema', 'pembebasan', 'organisasi', 'sayap', 'hti', 'xa']",mahfud pemerintah membubarkan hti koq gema pembebasan organisasi sayap hti,mahfud perintah bubar hti koq gema bebas organisasi sayap hti,,9
796,b'Pala bapak kau thogut.. ni pasti yg suka catcalling makanya ga setuju\n\nhttps://t.co/J9LOkFOsgf',b'pala bapak kau thogut.. ni pasti yg suka catcalling makanya ga setuju\n\nhttps://t.co/j9lokfosgf',pala bapak kau thogut ni pasti yg suka catcalling makanya ga setuju,"['pala', 'bapak', 'kau', 'thogut', 'ni', 'pasti', 'yg', 'suka', 'catcalling', 'makanya', 'ga', 'setuju']","['pala', 'bapak', 'kau', 'thogut', 'ni', 'pasti', 'yg', 'suka', 'catcalling', 'makanya', 'ga', 'setuju']",pala kau thogut ni yg suka catcalling ga setuju,pala kau thogut ni yg suka catcalling ga tuju,0,
5408,b'@TofaTofa_id Pasti belum baca https://t.co/wvEhP5dKG9',b'@tofatofa_id pasti belum baca https://t.co/wvehp5dkg9',pasti belum baca,"['pasti', 'belum', 'baca']","['pasti', 'belum', 'baca']",baca,baca,0,
2197,"b'PBNU Dukung Implementasi Permendikbudristek PPKS, tapi Perlu Revisi https://t.co/s40wAkvKCV'","b'pbnu dukung implementasi permendikbudristek ppks, tapi perlu revisi https://t.co/s40wakvkcv'",pbnu dukung implementasi permendikbudristek ppks tapi perlu revisi,"['pbnu', 'dukung', 'implementasi', 'permendikbudristek', 'ppks', 'tapi', 'perlu', 'revisi']","['pbnu', 'dukung', 'implementasi', 'permendikbudristek', 'ppks', 'tapi', 'perlu', 'revisi']",pbnu dukung implementasi permendikbudristek ppks revisi,pbnu dukung implementasi permendikbudristek ppks revisi,0,
2144,"b'PBNU Dukung Penuh Permendikbudristek PPKS, tapi Perlu Diperbaiki https://t.co/pSH5z9yNYm'","b'pbnu dukung penuh permendikbudristek ppks, tapi perlu diperbaiki https://t.co/psh5z9ynym'",pbnu dukung penuh permendikbudristek ppks tapi perlu diperbaiki,"['pbnu', 'dukung', 'penuh', 'permendikbudristek', 'ppks', 'tapi', 'perlu', 'diperbaiki']","['pbnu', 'dukung', 'penuh', 'permendikbudristek', 'ppks', 'tapi', 'perlu', 'diperbaiki']",pbnu dukung penuh permendikbudristek ppks diperbaiki,pbnu dukung penuh permendikbudristek ppks baik,0,
1050,b'Pembahasan mengenai miskonsepsi Permendikbudristek PPKS yang beredar luas di masyarakat dikemas dalam sebuah cerita\xe2\x80\xa6 https://t.co/ifrJdKMece',b'pembahasan mengenai miskonsepsi permendikbudristek ppks yang beredar luas di masyarakat dikemas dalam sebuah cerita\xe2\x80\xa6 https://t.co/ifrjdkmece',pembahasan mengenai miskonsepsi permendikbudristek ppks yang beredar luas di masyarakat dikemas dalam sebuah cerita  xa,"['pembahasan', 'mengenai', 'miskonsepsi', 'permendikbudristek', 'ppks', 'yang', 'beredar', 'luas', 'di', 'masyarakat', 'dikemas', 'dalam', 'sebuah', 'cerita', 'xa']","['pembahasan', 'mengenai', 'miskonsepsi', 'permendikbudristek', 'ppks', 'yang', 'beredar', 'luas', 'di', 'masyarakat', 'dikemas', 'dalam', 'sebuah', 'cerita', 'xa']",pembahasan miskonsepsi permendikbudristek ppks beredar luas masyarakat dikemas cerita,bahas miskonsepsi permendikbudristek ppks edar luas masyarakat kemas cerita,0,
959,b'Pemerhati : Permendikbudristek PPKS Tidak akan Ada Manfaatnya https://t.co/90YgHrk4xa',b'pemerhati : permendikbudristek ppks tidak akan ada manfaatnya https://t.co/90yghrk4xa',pemerhati permendikbudristek ppks tidak akan ada manfaatnya,"['pemerhati', 'permendikbudristek', 'ppks', 'tidak', 'akan', 'ada', 'manfaatnya']","['pemerhati', 'permendikbudristek', 'ppks', 'tidak', 'akan', 'ada', 'manfaatnya']",pemerhati permendikbudristek ppks manfaatnya,perhati permendikbudristek ppks manfaat,0,
964,b'Peraturan yang cukup progresif dalam hal pemajuan dan perlindungan perempuan dari kekerasan berbasis gender telah t\xe2\x80\xa6 https://t.co/mhOfUElj7C',b'peraturan yang cukup progresif dalam hal pemajuan dan perlindungan perempuan dari kekerasan berbasis gender telah t\xe2\x80\xa6 https://t.co/mhofuelj7c',peraturan yang cukup progresif dalam hal pemajuan dan perlindungan perempuan dari kekerasan berbasis gender telah  xa,"['peraturan', 'yang', 'cukup', 'progresif', 'dalam', 'hal', 'pemajuan', 'dan', 'perlindungan', 'perempuan', 'dari', 'kekerasan', 'berbasis', 'gender', 'telah', 'xa']","['peraturan', 'yang', 'cukup', 'progresif', 'dalam', 'hal', 'pemajuan', 'dan', 'perlindungan', 'perempuan', 'dari', 'kekerasan', 'berbasis', 'gender', 'telah', 'xa']",peraturan progresif pemajuan perlindungan perempuan kekerasan berbasis gender,atur progresif maju lindung perempuan keras bas gender,1,
1796,b'[PERBANDINGAN PERTOR NOMOR 70 TAHUN 2020 PENCEGAHAN DAN PENANGANAN KEKERASAN SEKSUAL DAN PERUNDUNGAN DENGAN PERMEND\xe2\x80\xa6 https://t.co/06dZyoq5P9',b'[perbandingan pertor nomor 70 tahun 2020 pencegahan dan penanganan kekerasan seksual dan perundungan dengan permend\xe2\x80\xa6 https://t.co/06dzyoq5p9',perbandingan pertor nomor tahun pencegahan dan penanganan kekerasan seksual dan perundungan dengan permend  xa,"['perbandingan', 'pertor', 'nomor', 'tahun', 'pencegahan', 'dan', 'penanganan', 'kekerasan', 'seksual', 'dan', 'perundungan', 'dengan', 'permend', 'xa']","['perbandingan', 'pertor', 'nomor', 'tahun', 'pencegahan', 'dan', 'penanganan', 'kekerasan', 'seksual', 'dan', 'perundungan', 'dengan', 'permend', 'xa']",perbandingan pertor nomor pencegahan penanganan kekerasan seksual perundungan permend,banding pertor nomor cegah tangan keras seksual rundung permend,0,
1847,b'percayalah kalo ada akademisi atau orang yg ga setuju sama permendikbud PPKS ini mental2 pelaku https://t.co/1CVmXIvabm',b'percayalah kalo ada akademisi atau orang yg ga setuju sama permendikbud ppks ini mental2 pelaku https://t.co/1cvmxivabm',percayalah kalo ada akademisi atau orang yg ga setuju sama permendikbud ppks ini mental pelaku,"['percayalah', 'kalo', 'ada', 'akademisi', 'atau', 'orang', 'yg', 'ga', 'setuju', 'sama', 'permendikbud', 'ppks', 'ini', 'mental', 'pelaku']","['percayalah', 'kalo', 'ada', 'akademisi', 'atau', 'orang', 'yg', 'ga', 'setuju', 'sama', 'permendikbud', 'ppks', 'ini', 'mental', 'pelaku']",percayalah kalo akademisi orang yg ga setuju permendikbud ppks mental pelaku,percaya kalo akademisi orang yg ga tuju permendikbud ppks mental laku,1,
4122,"b'@CNNIndonesia Perlukah permen PPKS diterapkan di lingkungan lembaga negara, agar korban mendapatkan perlindungan? T\xe2\x80\xa6 https://t.co/1yNJM5mPXx'","b'@cnnindonesia perlukah permen ppks diterapkan di lingkungan lembaga negara, agar korban mendapatkan perlindungan? t\xe2\x80\xa6 https://t.co/1ynjm5mpxx'",perlukah permen ppks diterapkan di lingkungan lembaga negara agar korban mendapatkan perlindungan  xa,"['perlukah', 'permen', 'ppks', 'diterapkan', 'di', 'lingkungan', 'lembaga', 'negara', 'agar', 'korban', 'mendapatkan', 'perlindungan', 'xa']","['perlukah', 'permen', 'ppks', 'diterapkan', 'di', 'lingkungan', 'lembaga', 'negara', 'agar', 'korban', 'mendapatkan', 'perlindungan', 'xa']",permen ppks diterapkan lingkungan lembaga negara korban perlindungan,permen ppks terap lingkung lembaga negara korban lindung,1,
1180,b'Permen PPKS Bukan Solusi Kekerasan Seksual https://t.co/qXhmWhzHRC lewat @suaraislam_id',b'permen ppks bukan solusi kekerasan seksual https://t.co/qxhmwhzhrc lewat @suaraislam_id',permen ppks bukan solusi kekerasan seksual lewat,"['permen', 'ppks', 'bukan', 'solusi', 'kekerasan', 'seksual', 'lewat']","['permen', 'ppks', 'bukan', 'solusi', 'kekerasan', 'seksual', 'lewat']",permen ppks solusi kekerasan seksual,permen ppks solusi keras seksual,0,
5411,b'@AREAJULID Permen PPKS klu bener2 diaplikasikan bakal bisa memberantas predator seksual didunia pendidikan.',b'@areajulid permen ppks klu bener2 diaplikasikan bakal bisa memberantas predator seksual didunia pendidikan.',permen ppks klu bener diaplikasikan bakal bisa memberantas predator seksual didunia pendidikan,"['permen', 'ppks', 'klu', 'bener', 'diaplikasikan', 'bakal', 'bisa', 'memberantas', 'predator', 'seksual', 'didunia', 'pendidikan']","['permen', 'ppks', 'klu', 'bener', 'diaplikasikan', 'bakal', 'bisa', 'memberantas', 'predator', 'seksual', 'didunia', 'pendidikan']",permen ppks klu bener diaplikasikan memberantas predator seksual didunia pendidikan,permen ppks klu bener aplikasi berantas predator seksual dunia didik,1,
954,b'Permendikbud No. 30 Tahun 2021 berisikan peraturan mengenai Pencegahan dan Penanganan Kekerasan Seksual (PPKS) di L\xe2\x80\xa6 https://t.co/eYbp0OD53f',b'permendikbud no. 30 tahun 2021 berisikan peraturan mengenai pencegahan dan penanganan kekerasan seksual (ppks) di l\xe2\x80\xa6 https://t.co/eybp0od53f',permendikbud no tahun berisikan peraturan mengenai pencegahan dan penanganan kekerasan seksual ppks di  xa,"['permendikbud', 'no', 'tahun', 'berisikan', 'peraturan', 'mengenai', 'pencegahan', 'dan', 'penanganan', 'kekerasan', 'seksual', 'ppks', 'di', 'xa']","['permendikbud', 'no', 'tahun', 'berisikan', 'peraturan', 'mengenai', 'pencegahan', 'dan', 'penanganan', 'kekerasan', 'seksual', 'ppks', 'di', 'xa']",permendikbud no berisikan peraturan pencegahan penanganan kekerasan seksual ppks,permendikbud no risi atur cegah tangan keras seksual ppks,1,
1018,b'PERMENDIKBUD NO 30 TAHUN 2021 BUKAN SOLUSI KEKERASAN SEKSUAL\n\nBaru saja permendikbud no 30 tahun 2021 mengenai penc\xe2\x80\xa6 https://t.co/gxzHs2PgeM',b'permendikbud no 30 tahun 2021 bukan solusi kekerasan seksual\n\nbaru saja permendikbud no 30 tahun 2021 mengenai penc\xe2\x80\xa6 https://t.co/gxzhs2pgem',permendikbud no tahun bukan solusi kekerasan seksual nbaru saja permendikbud no tahun mengenai penc  xa,"['permendikbud', 'no', 'tahun', 'bukan', 'solusi', 'kekerasan', 'seksual', 'nbaru', 'saja', 'permendikbud', 'no', 'tahun', 'mengenai', 'penc', 'xa']","['permendikbud', 'no', 'tahun', 'bukan', 'solusi', 'kekerasan', 'seksual', 'nbaru', 'saja', 'permendikbud', 'no', 'tahun', 'mengenai', 'penc', 'xa']",permendikbud no solusi kekerasan seksual nbaru permendikbud no penc,permendikbud no solusi keras seksual nbaru permendikbud no penc,0,
97,b'@muslimahnewscom Permendikbud no 30 ttg PPKS membuktikan rezim sekuler liberal!',b'@muslimahnewscom permendikbud no 30 ttg ppks membuktikan rezim sekuler liberal!',permendikbud no ttg ppks membuktikan rezim sekuler liberal,"['permendikbud', 'no', 'ttg', 'ppks', 'membuktikan', 'rezim', 'sekuler', 'liberal']","['permendikbud', 'no', 'ttg', 'ppks', 'membuktikan', 'rezim', 'sekuler', 'liberal']",permendikbud no ttg ppks membuktikan rezim sekuler liberal,permendikbud no ttg ppks bukti rezim sekuler liberal,0,
14,b'@collegemenfess Permendikbud ppks',b'@collegemenfess permendikbud ppks',permendikbud ppks,"['permendikbud', 'ppks']","['permendikbud', 'ppks']",permendikbud ppks,permendikbud ppks,,9
3354,b'permendikbud PPKS apa bisa diterapkan juga di RS untuk KS konsulen ke koas/ppds?',b'permendikbud ppks apa bisa diterapkan juga di rs untuk ks konsulen ke koas/ppds?',permendikbud ppks apa bisa diterapkan juga di rs untuk ks konsulen ke koas ppds,"['permendikbud', 'ppks', 'apa', 'bisa', 'diterapkan', 'juga', 'di', 'rs', 'untuk', 'ks', 'konsulen', 'ke', 'koas', 'ppds']","['permendikbud', 'ppks', 'apa', 'bisa', 'diterapkan', 'juga', 'di', 'rs', 'untuk', 'ks', 'konsulen', 'ke', 'koas', 'ppds']",permendikbud ppks diterapkan rs ks konsulen koas ppds,permendikbud ppks terap rs ks konsulen koas ppds,1,
5395,"b'Permendikbud PPKS Dirilis, Laporan Kekerasan Seksual Kampus\xc2\xa0Bermunculan https://t.co/tXTe2sXK08'","b'permendikbud ppks dirilis, laporan kekerasan seksual kampus\xc2\xa0bermunculan https://t.co/txte2sxk08'",permendikbud ppks dirilis laporan kekerasan seksual kampus xc xa bermunculan,"['permendikbud', 'ppks', 'dirilis', 'laporan', 'kekerasan', 'seksual', 'kampus', 'xc', 'xa', 'bermunculan']","['permendikbud', 'ppks', 'dirilis', 'laporan', 'kekerasan', 'seksual', 'kampus', 'xc', 'xa', 'bermunculan']",permendikbud ppks dirilis laporan kekerasan seksual kampus xc bermunculan,permendikbud ppks rilis lapor keras seksual kampus xc muncul,0,
4681,b'Permendikbud PPKS dirilis:\n\nSeks bebas makin menggila \xe2\x9c\x96\xef\xb8\x8f\xe2\x9c\x96\xef\xb8\x8f\xe2\x9c\x96\xef\xb8\x8f\nLaporan kekerasan seksual meningkat \xe2\x9c\x94\xef\xb8\x8f\xe2\x9c\x94\xef\xb8\x8f\xe2\x9c\x94\xef\xb8\x8f\n\nPredator k\xe2\x80\xa6 https://t.co/fnrvluYqGG',b'permendikbud ppks dirilis:\n\nseks bebas makin menggila \xe2\x9c\x96\xef\xb8\x8f\xe2\x9c\x96\xef\xb8\x8f\xe2\x9c\x96\xef\xb8\x8f\nlaporan kekerasan seksual meningkat \xe2\x9c\x94\xef\xb8\x8f\xe2\x9c\x94\xef\xb8\x8f\xe2\x9c\x94\xef\xb8\x8f\n\npredator k\xe2\x80\xa6 https://t.co/fnrvluyqgg',permendikbud ppks dirilis nseks bebas makin menggila  xef xb  xef xb  xef xb nlaporan kekerasan seksual meningkat  xef xb  xef xb  xef xb npredator  xa,"['permendikbud', 'ppks', 'dirilis', 'nseks', 'bebas', 'makin', 'menggila', 'xef', 'xb', 'xef', 'xb', 'xef', 'xb', 'nlaporan', 'kekerasan', 'seksual', 'meningkat', 'xef', 'xb', 'xef', 'xb', 'xef', 'xb', 'npredator', 'xa']","['permendikbud', 'ppks', 'dirilis', 'nseks', 'bebas', 'makin', 'menggila', 'xef', 'xb', 'xef', 'xb', 'xef', 'xb', 'nlaporan', 'kekerasan', 'seksual', 'meningkat', 'xef', 'xb', 'xef', 'xb', 'xef', 'xb', 'npredator', 'xa']",permendikbud ppks dirilis nseks bebas menggila xef xb xef xb xef xb nlaporan kekerasan seksual meningkat xef xb xef xb xef xb npredator,permendikbud ppks rilis nseks bebas gila xef xb xef xb xef xb nlaporan keras seksual tingkat xef xb xef xb xef xb npredator,0,
843,b'Permendikbud PPKS Harus Dicabut dan Tolak RUU\xc2\xa0TPKS https://t.co/932QznyVQa',b'permendikbud ppks harus dicabut dan tolak ruu\xc2\xa0tpks https://t.co/932qznyvqa',permendikbud ppks harus dicabut dan tolak ruu xc xa tpks,"['permendikbud', 'ppks', 'harus', 'dicabut', 'dan', 'tolak', 'ruu', 'xc', 'xa', 'tpks']","['permendikbud', 'ppks', 'harus', 'dicabut', 'dan', 'tolak', 'ruu', 'xc', 'xa', 'tpks']",permendikbud ppks dicabut tolak ruu xc tpks,permendikbud ppks cabut tolak ruu xc tpks,0,
1067,b'Permendikbud PPKS Harus Jadi Pelecut DPR Segera Sahkan RUU TPKS  https://t.co/oKzYOtfSnm',b'permendikbud ppks harus jadi pelecut dpr segera sahkan ruu tpks  https://t.co/okzyotfsnm',permendikbud ppks harus jadi pelecut dpr segera sahkan ruu tpks,"['permendikbud', 'ppks', 'harus', 'jadi', 'pelecut', 'dpr', 'segera', 'sahkan', 'ruu', 'tpks']","['permendikbud', 'ppks', 'harus', 'jadi', 'pelecut', 'dpr', 'segera', 'sahkan', 'ruu', 'tpks']",permendikbud ppks pelecut dpr sahkan ruu tpks,permendikbud ppks lecut dpr sahkan ruu tpks,0,
3011,"b'Permendikbud PPKS ini disinyalir melegalkan zina, padahal konsep ""Consent"" yang terkandung didalamnya memiliki pema\xe2\x80\xa6 https://t.co/qF1pEeC99V'","b'permendikbud ppks ini disinyalir melegalkan zina, padahal konsep ""consent"" yang terkandung didalamnya memiliki pema\xe2\x80\xa6 https://t.co/qf1peec99v'",permendikbud ppks ini disinyalir melegalkan zina padahal konsep consent yang terkandung didalamnya memiliki pema  xa,"['permendikbud', 'ppks', 'ini', 'disinyalir', 'melegalkan', 'zina', 'padahal', 'konsep', 'consent', 'yang', 'terkandung', 'didalamnya', 'memiliki', 'pema', 'xa']","['permendikbud', 'ppks', 'ini', 'disinyalir', 'melegalkan', 'zina', 'padahal', 'konsep', 'consent', 'yang', 'terkandung', 'didalamnya', 'memiliki', 'pema', 'xa']",permendikbud ppks disinyalir melegalkan zina konsep consent terkandung didalamnya memiliki pema,permendikbud ppks sinyalir legal zina konsep consent kandung dalam milik pema,0,
977,"b'Permendikbud PPKS, Mengatasi Masalah dengan\xc2\xa0Masalah https://t.co/ViUSoS97DW'","b'permendikbud ppks, mengatasi masalah dengan\xc2\xa0masalah https://t.co/viusos97dw'",permendikbud ppks mengatasi masalah dengan xc xa masalah,"['permendikbud', 'ppks', 'mengatasi', 'masalah', 'dengan', 'xc', 'xa', 'masalah']","['permendikbud', 'ppks', 'mengatasi', 'masalah', 'dengan', 'xc', 'xa', 'masalah']",permendikbud ppks mengatasi xc,permendikbud ppks atas xc,0,
536,"b'Permendikbud PPKS menuai kecaman dari berbagai pihak karena dianggap melegalkan perzinaan. Menurut Nadiem, ia mener\xe2\x80\xa6 https://t.co/5kB4SWAwhN'","b'permendikbud ppks menuai kecaman dari berbagai pihak karena dianggap melegalkan perzinaan. menurut nadiem, ia mener\xe2\x80\xa6 https://t.co/5kb4swawhn'",permendikbud ppks menuai kecaman dari berbagai pihak karena dianggap melegalkan perzinaan menurut nadiem ia mener  xa,"['permendikbud', 'ppks', 'menuai', 'kecaman', 'dari', 'berbagai', 'pihak', 'karena', 'dianggap', 'melegalkan', 'perzinaan', 'menurut', 'nadiem', 'ia', 'mener', 'xa']","['permendikbud', 'ppks', 'menuai', 'kecaman', 'dari', 'berbagai', 'pihak', 'karena', 'dianggap', 'melegalkan', 'perzinaan', 'menurut', 'nadiem', 'ia', 'mener', 'xa']",permendikbud ppks menuai kecaman dianggap melegalkan perzinaan nadiem mener,permendikbud ppks tuai kecam anggap legal zina nadiem ter,0,
5373,b'Permendikbud PPKS Solusikah? https://t.co/Fw4KFcOZAA',b'permendikbud ppks solusikah? https://t.co/fw4kfcozaa',permendikbud ppks solusikah,"['permendikbud', 'ppks', 'solusikah']","['permendikbud', 'ppks', 'solusikah']",permendikbud ppks solusikah,permendikbud ppks solusi,0,
2904,"b'Permendikbud PPKS Tua Pro-Kontra, Nadiem Minta Masukan PBNU https://t.co/DclrukaB1t #beritajogja #jogja\xe2\x80\xa6 https://t.co/I7gZvLZpoA'","b'permendikbud ppks tua pro-kontra, nadiem minta masukan pbnu https://t.co/dclrukab1t #beritajogja #jogja\xe2\x80\xa6 https://t.co/i7gzvlzpoa'",permendikbud ppks tua pro kontra nadiem minta masukan pbnu beritajogja jogja  xa,"['permendikbud', 'ppks', 'tua', 'pro', 'kontra', 'nadiem', 'minta', 'masukan', 'pbnu', 'beritajogja', 'jogja', 'xa']","['permendikbud', 'ppks', 'tua', 'pro', 'kontra', 'nadiem', 'minta', 'masukan', 'pbnu', 'beritajogja', 'jogja', 'xa']",permendikbud ppks tua pro kontra nadiem masukan pbnu beritajogja jogja,permendikbud ppks tua pro kontra nadiem masuk pbnu beritajogja jogja,0,
5419,"b'Permendikbud Ristek PPKS, Liberalisasi Seksual Menyasar Institusi PT\n\nOleh: Zulia Adi K, S.E\n[Pengamat Pendidikan]\nhttps://t.co/fjGmykCffj'","b'permendikbud ristek ppks, liberalisasi seksual menyasar institusi pt\n\noleh: zulia adi k, s.e\n[pengamat pendidikan]\nhttps://t.co/fjgmykcffj'",permendikbud ristek ppks liberalisasi seksual menyasar institusi pt noleh zulia adi,"['permendikbud', 'ristek', 'ppks', 'liberalisasi', 'seksual', 'menyasar', 'institusi', 'pt', 'noleh', 'zulia', 'adi']","['permendikbud', 'ristek', 'ppks', 'liberalisasi', 'seksual', 'menyasar', 'institusi', 'pt', 'noleh', 'zulia', 'adi']",permendikbud ristek ppks liberalisasi seksual menyasar institusi pt noleh zulia adi,permendikbud ristek ppks liberalisasi seksual sasar institusi pt noleh zulia adi,0,
5428,"b""Permendikbud Ristek PPKS, Liberalisasi Seksual Menyasar Kampus\n\nOleh: Yafi'ah Nurul Salsabila\n[Alumni IPRIJA dan Ak\xe2\x80\xa6 https://t.co/FAtcXSyUjU""","b""permendikbud ristek ppks, liberalisasi seksual menyasar kampus\n\noleh: yafi'ah nurul salsabila\n[alumni iprija dan ak\xe2\x80\xa6 https://t.co/fatcxsyuju""",permendikbud ristek ppks liberalisasi seksual menyasar kampus noleh yafi ah nurul salsabila alumni iprija dan ak  xa,"['permendikbud', 'ristek', 'ppks', 'liberalisasi', 'seksual', 'menyasar', 'kampus', 'noleh', 'yafi', 'ah', 'nurul', 'salsabila', 'alumni', 'iprija', 'dan', 'ak', 'xa']","['permendikbud', 'ristek', 'ppks', 'liberalisasi', 'seksual', 'menyasar', 'kampus', 'noleh', 'yafi', 'ah', 'nurul', 'salsabila', 'alumni', 'iprija', 'dan', 'ak', 'xa']",permendikbud ristek ppks liberalisasi seksual menyasar kampus noleh yafi ah nurul salsabila alumni iprija ak,permendikbud ristek ppks liberalisasi seksual sasar kampus noleh yafi ah nurul salsabila alumni iprija ak,0,
