,Tweets,Case_Folding,Data_Cleaning,Tokenize,Normalization,Stopwords,Stemming,Label,
275,b'#Fokus \xe2\x80\x94  Keterbelahan suara mahasiswa (muslim) dalam menyikapi Permen PPKS bukan tanpa sebab. Mahasiswa sampai saa\xe2\x80\xa6 https://t.co/1ouOoUxd3A',b'#fokus \xe2\x80\x94  keterbelahan suara mahasiswa (muslim) dalam menyikapi permen ppks bukan tanpa sebab. mahasiswa sampai saa\xe2\x80\xa6 https://t.co/1ouoouxd3a',fokus  keterbelahan suara mahasiswa muslim dalam menyikapi permen ppks bukan tanpa sebab mahasiswa sampai saa  xa,"['fokus', 'keterbelahan', 'suara', 'mahasiswa', 'muslim', 'dalam', 'menyikapi', 'permen', 'ppks', 'bukan', 'tanpa', 'sebab', 'mahasiswa', 'sampai', 'saa', 'xa']","['fokus', 'keterbelahan', 'suara', 'mahasiswa', 'muslim', 'dalam', 'menyikapi', 'permen', 'ppks', 'bukan', 'tanpa', 'sebab', 'mahasiswa', 'sampai', 'saa', 'xa']",fokus keterbelahan suara mahasiswa muslim menyikapi permen ppks mahasiswa saa,fokus belah suara mahasiswa muslim sikap permen ppks mahasiswa saa,0,
304,"b'#Fokus \xe2\x80\x94 Sungguh sayang, suara mahasiswa terbelah dalam menyikapi kehadiran Permen PPKS. Berbeda dengan suara mahas\xe2\x80\xa6 https://t.co/jQMImfHRYF'","b'#fokus \xe2\x80\x94 sungguh sayang, suara mahasiswa terbelah dalam menyikapi kehadiran permen ppks. berbeda dengan suara mahas\xe2\x80\xa6 https://t.co/jqmimfhryf'",fokus  sungguh sayang suara mahasiswa terbelah dalam menyikapi kehadiran permen ppks berbeda dengan suara mahas  xa,"['fokus', 'sungguh', 'sayang', 'suara', 'mahasiswa', 'terbelah', 'dalam', 'menyikapi', 'kehadiran', 'permen', 'ppks', 'berbeda', 'dengan', 'suara', 'mahas', 'xa']","['fokus', 'sungguh', 'sayang', 'suara', 'mahasiswa', 'terbelah', 'dalam', 'menyikapi', 'kehadiran', 'permen', 'ppks', 'berbeda', 'dengan', 'suara', 'mahas', 'xa']",fokus sungguh sayang suara mahasiswa terbelah menyikapi kehadiran permen ppks berbeda suara mahas,fokus sungguh sayang suara mahasiswa belah sikap hadir permen ppks beda suara mahas,0,
122,"b'#Fokus \xe2\x80\x94 Sungguh teramat sayang, suara mahasiswa terbelah dalam menyikapi kehadiran Permen PPKS. Berbeda dengan sua\xe2\x80\xa6 https://t.co/ThFPU8Fpie'","b'#fokus \xe2\x80\x94 sungguh teramat sayang, suara mahasiswa terbelah dalam menyikapi kehadiran permen ppks. berbeda dengan sua\xe2\x80\xa6 https://t.co/thfpu8fpie'",fokus  sungguh teramat sayang suara mahasiswa terbelah dalam menyikapi kehadiran permen ppks berbeda dengan sua  xa,"['fokus', 'sungguh', 'teramat', 'sayang', 'suara', 'mahasiswa', 'terbelah', 'dalam', 'menyikapi', 'kehadiran', 'permen', 'ppks', 'berbeda', 'dengan', 'sua', 'xa']","['fokus', 'sungguh', 'teramat', 'sayang', 'suara', 'mahasiswa', 'terbelah', 'dalam', 'menyikapi', 'kehadiran', 'permen', 'ppks', 'berbeda', 'dengan', 'sua', 'xa']",fokus sungguh teramat sayang suara mahasiswa terbelah menyikapi kehadiran permen ppks berbeda sua,fokus sungguh amat sayang suara mahasiswa belah sikap hadir permen ppks beda sua,0,
181,"b'#Fokus \xe2\x80\x94 Sungguh teramat sayang, suara mahasiswa terbelah dlm menyikapi kehadiran Permen PPKS. Berbeda dgn suara ma\xe2\x80\xa6 https://t.co/ne0LQhk7uj'","b'#fokus \xe2\x80\x94 sungguh teramat sayang, suara mahasiswa terbelah dlm menyikapi kehadiran permen ppks. berbeda dgn suara ma\xe2\x80\xa6 https://t.co/ne0lqhk7uj'",fokus  sungguh teramat sayang suara mahasiswa terbelah dlm menyikapi kehadiran permen ppks berbeda dgn suara ma  xa,"['fokus', 'sungguh', 'teramat', 'sayang', 'suara', 'mahasiswa', 'terbelah', 'dlm', 'menyikapi', 'kehadiran', 'permen', 'ppks', 'berbeda', 'dgn', 'suara', 'ma', 'xa']","['fokus', 'sungguh', 'teramat', 'sayang', 'suara', 'mahasiswa', 'terbelah', 'dlm', 'menyikapi', 'kehadiran', 'permen', 'ppks', 'berbeda', 'dgn', 'suara', 'ma', 'xa']",fokus sungguh teramat sayang suara mahasiswa terbelah dlm menyikapi kehadiran permen ppks berbeda dgn suara ma,fokus sungguh amat sayang suara mahasiswa belah dlm sikap hadir permen ppks beda dgn suara ma,0,
123,"b'#Fokus\n#MuslimahNewsCom \xe2\x80\x94 Sungguh teramat sayang, suara mahasiswa terbelah dalam menyikapi kehadiran Permen PPKS. B\xe2\x80\xa6 https://t.co/h9Bim1rVNU'","b'#fokus\n#muslimahnewscom \xe2\x80\x94 sungguh teramat sayang, suara mahasiswa terbelah dalam menyikapi kehadiran permen ppks. b\xe2\x80\xa6 https://t.co/h9bim1rvnu'",fokus muslimahnewscom  sungguh teramat sayang suara mahasiswa terbelah dalam menyikapi kehadiran permen ppks  xa,"['fokus', 'muslimahnewscom', 'sungguh', 'teramat', 'sayang', 'suara', 'mahasiswa', 'terbelah', 'dalam', 'menyikapi', 'kehadiran', 'permen', 'ppks', 'xa']","['fokus', 'muslimahnewscom', 'sungguh', 'teramat', 'sayang', 'suara', 'mahasiswa', 'terbelah', 'dalam', 'menyikapi', 'kehadiran', 'permen', 'ppks', 'xa']",fokus muslimahnewscom sungguh teramat sayang suara mahasiswa terbelah menyikapi kehadiran permen ppks,fokus muslimahnewscom sungguh amat sayang suara mahasiswa belah sikap hadir permen ppks,0,
5262,"b'Gagal Paham, Nadiem Tegaskan Ruang Lingkup Permendikbud PPKS Bukan Soal Tindakan Asusila di Kampus\n \nhttps://t.co/4d7BsO9Te9'","b'gagal paham, nadiem tegaskan ruang lingkup permendikbud ppks bukan soal tindakan asusila di kampus\n \nhttps://t.co/4d7bso9te9'",gagal paham nadiem tegaskan ruang lingkup permendikbud ppks bukan soal tindakan asusila di kampus,"['gagal', 'paham', 'nadiem', 'tegaskan', 'ruang', 'lingkup', 'permendikbud', 'ppks', 'bukan', 'soal', 'tindakan', 'asusila', 'di', 'kampus']","['gagal', 'paham', 'nadiem', 'tegaskan', 'ruang', 'lingkup', 'permendikbud', 'ppks', 'bukan', 'soal', 'tindakan', 'asusila', 'di', 'kampus']",gagal paham nadiem tegaskan ruang lingkup permendikbud ppks tindakan asusila kampus,gagal paham nadiem tegas ruang lingkup permendikbud ppks tindak asusila kampus,1,
1339,b'Gelar FGD Respons Permendikbudristek No. 30 tahun 2021 tentang PPKS https://t.co/iVu2YiHDGe',b'gelar fgd respons permendikbudristek no. 30 tahun 2021 tentang ppks https://t.co/ivu2yihdge',gelar fgd respons permendikbudristek no tahun tentang ppks,"['gelar', 'fgd', 'respons', 'permendikbudristek', 'no', 'tahun', 'tentang', 'ppks']","['gelar', 'fgd', 'respons', 'permendikbudristek', 'no', 'tahun', 'tentang', 'ppks']",gelar fgd respons permendikbudristek no ppks,gelar fgd respons permendikbudristek no ppks,,9
1233,"b""Gengs podcast hari ini udah tayang! \n\nToday we're talking about Permendikbud PPKS resmi berlaku, Taliban larang per\xe2\x80\xa6 https://t.co/46sfTkl1MB""","b""gengs podcast hari ini udah tayang! \n\ntoday we're talking about permendikbud ppks resmi berlaku, taliban larang per\xe2\x80\xa6 https://t.co/46sftkl1mb""",gengs podcast hari ini udah tayang ntoday we re talking about permendikbud ppks resmi berlaku taliban larang per  xa,"['gengs', 'podcast', 'hari', 'ini', 'udah', 'tayang', 'ntoday', 'we', 're', 'talking', 'about', 'permendikbud', 'ppks', 'resmi', 'berlaku', 'taliban', 'larang', 'per', 'xa']","['gengs', 'podcast', 'hari', 'ini', 'udah', 'tayang', 'ntoday', 'we', 're', 'talking', 'about', 'permendikbud', 'ppks', 'resmi', 'berlaku', 'taliban', 'larang', 'per', 'xa']",gengs podcast udah tayang ntoday we re talking about permendikbud ppks resmi berlaku taliban larang,gengs podcast udah tayang ntoday we re talking about permendikbud ppks resmi laku talib larang,1,
893,b'Gila udah berani terang2an gini!\nGubsu Edi ama Walkot Bobby harus berani tegas!\nAparat juga boleh bertindak nih.\nMa\xe2\x80\xa6 https://t.co/LdBZhpVxzp',b'gila udah berani terang2an gini!\ngubsu edi ama walkot bobby harus berani tegas!\naparat juga boleh bertindak nih.\nma\xe2\x80\xa6 https://t.co/ldbzhpvxzp',gila udah berani terang an gini ngubsu edi ama walkot bobby harus berani tegas naparat juga boleh bertindak nih nma  xa,"['gila', 'udah', 'berani', 'terang', 'an', 'gini', 'ngubsu', 'edi', 'ama', 'walkot', 'bobby', 'harus', 'berani', 'tegas', 'naparat', 'juga', 'boleh', 'bertindak', 'nih', 'nma', 'xa']","['gila', 'udah', 'berani', 'terang', 'an', 'gini', 'ngubsu', 'edi', 'ama', 'walkot', 'bobby', 'harus', 'berani', 'tegas', 'naparat', 'juga', 'boleh', 'bertindak', 'nih', 'nma', 'xa']",gila udah berani terang an gini ngubsu edi ama walkot bobby berani naparat bertindak nih nma,gila udah berani terang an gin ngubsu edi ama walkot bobby berani naparat tindak nih nma,1,
828,b'Gimana nih pak @mohmahfudmd \npendapat anda Ormas yg sudah dilarang oleh negara makin berani unjuk gigi di depan pub\xe2\x80\xa6 https://t.co/CLofuyOlET',b'gimana nih pak @mohmahfudmd \npendapat anda ormas yg sudah dilarang oleh negara makin berani unjuk gigi di depan pub\xe2\x80\xa6 https://t.co/clofuyolet',gimana nih pak npendapat anda ormas yg sudah dilarang oleh negara makin berani unjuk gigi di depan pub  xa,"['gimana', 'nih', 'pak', 'npendapat', 'anda', 'ormas', 'yg', 'sudah', 'dilarang', 'oleh', 'negara', 'makin', 'berani', 'unjuk', 'gigi', 'di', 'depan', 'pub', 'xa']","['gimana', 'nih', 'pak', 'npendapat', 'anda', 'ormas', 'yg', 'sudah', 'dilarang', 'oleh', 'negara', 'makin', 'berani', 'unjuk', 'gigi', 'di', 'depan', 'pub', 'xa']",gimana nih npendapat ormas yg dilarang negara berani unjuk gigi pub,gimana nih npendapat ormas yg larang negara berani unjuk gigi pub,0,
5070,b'@PBPGRI_OFFICIAL Gimana sikap PGRI terhadap permendikbud No. 30 th 2021 tentang PPKS mimin?',b'@pbpgri_official gimana sikap pgri terhadap permendikbud no. 30 th 2021 tentang ppks mimin?',gimana sikap pgri terhadap permendikbud no th tentang ppks mimin,"['gimana', 'sikap', 'pgri', 'terhadap', 'permendikbud', 'no', 'th', 'tentang', 'ppks', 'mimin']","['gimana', 'sikap', 'pgri', 'terhadap', 'permendikbud', 'no', 'th', 'tentang', 'ppks', 'mimin']",gimana sikap pgri permendikbud no th ppks mimin,gimana sikap pgri permendikbud no th ppks mimin,,9
125,b'Gmn nih pak @mohmahfudmd\n@Puspen_TNI @binofficial_ri @BNPTRI\n@YaqutCQoumas @Kemenag_RI\n\nApakah ini msh di anggep lu\xe2\x80\xa6 https://t.co/KWOlSj7FFD',b'gmn nih pak @mohmahfudmd\n@puspen_tni @binofficial_ri @bnptri\n@yaqutcqoumas @kemenag_ri\n\napakah ini msh di anggep lu\xe2\x80\xa6 https://t.co/kwolsj7ffd',gmn nih pak ini msh di anggep lu  xa,"['gmn', 'nih', 'pak', 'ini', 'msh', 'di', 'anggep', 'lu', 'xa']","['gmn', 'nih', 'pak', 'ini', 'msh', 'di', 'anggep', 'lu', 'xa']",gmn nih msh anggep lu,gmn nih msh anggep lu,,9
4809,b'@bertanyarl Good berarti byk yg berani speak out sejak ada permendikbud ppks',b'@bertanyarl good berarti byk yg berani speak out sejak ada permendikbud ppks',good berarti byk yg berani speak out sejak ada permendikbud ppks,"['good', 'berarti', 'byk', 'yg', 'berani', 'speak', 'out', 'sejak', 'ada', 'permendikbud', 'ppks']","['good', 'berarti', 'byk', 'yg', 'berani', 'speak', 'out', 'sejak', 'ada', 'permendikbud', 'ppks']",good byk yg berani speak out permendikbud ppks,good byk yg berani speak out permendikbud ppks,1,
708,b'Gubernur Sumut harus tegas! Jangan dibiarkan!\nhttps://t.co/WbTOHAabYL',b'gubernur sumut harus tegas! jangan dibiarkan!\nhttps://t.co/wbtohaabyl',gubernur sumut harus tegas jangan dibiarkan,"['gubernur', 'sumut', 'harus', 'tegas', 'jangan', 'dibiarkan']","['gubernur', 'sumut', 'harus', 'tegas', 'jangan', 'dibiarkan']",gubernur sumut dibiarkan,gubernur sumut biar,,9
0,"b'@fmuchtar_ Gue setuju, makanya Anies gue bilang hebat. Si mustofa aja sampe bikin pembelaan lho soal aturan interna\xe2\x80\xa6 https://t.co/GxdQK2znPb'","b'@fmuchtar_ gue setuju, makanya anies gue bilang hebat. si mustofa aja sampe bikin pembelaan lho soal aturan interna\xe2\x80\xa6 https://t.co/gxdqk2znpb'",gue setuju makanya anies gue bilang hebat si mustofa aja sampe bikin pembelaan lho soal aturan interna  xa,"['gue', 'setuju', 'makanya', 'anies', 'gue', 'bilang', 'hebat', 'si', 'mustofa', 'aja', 'sampe', 'bikin', 'pembelaan', 'lho', 'soal', 'aturan', 'interna', 'xa']","['gue', 'setuju', 'makanya', 'anies', 'gue', 'bilang', 'hebat', 'si', 'mustofa', 'aja', 'sampe', 'bikin', 'pembelaan', 'lho', 'soal', 'aturan', 'interna', 'xa']",gue setuju anies gue bilang hebat si mustofa aja sampe bikin pembelaan lho aturan interna,gue tuju anies gue bilang hebat si mustofa aja sampe bikin bela lho atur interna,1,
3351,"b'[cm] guys, kan aku ada tugas kuliah buat berita artikel gitu. nah aku mau bahas tentang Permendikbud ppks. kalo mis\xe2\x80\xa6 https://t.co/jHouqYrT20'","b'[cm] guys, kan aku ada tugas kuliah buat berita artikel gitu. nah aku mau bahas tentang permendikbud ppks. kalo mis\xe2\x80\xa6 https://t.co/jhouqyrt20'",guys kan aku ada tugas kuliah buat berita artikel gitu nah aku mau bahas tentang permendikbud ppks kalo mis  xa,"['guys', 'kan', 'aku', 'ada', 'tugas', 'kuliah', 'buat', 'berita', 'artikel', 'gitu', 'nah', 'aku', 'mau', 'bahas', 'tentang', 'permendikbud', 'ppks', 'kalo', 'mis', 'xa']","['guys', 'kan', 'aku', 'ada', 'tugas', 'kuliah', 'buat', 'berita', 'artikel', 'gitu', 'nah', 'aku', 'mau', 'bahas', 'tentang', 'permendikbud', 'ppks', 'kalo', 'mis', 'xa']",guys tugas kuliah berita artikel gitu bahas permendikbud ppks kalo mis,guys tugas kuliah berita artikel gitu bahas permendikbud ppks kalo mis,,9
5122,"b'Hadirnya Permendikbud PPKS mendesak kampus untuk bentuk Satgas. Namun, bagaimana di Unmul?\n\nSimak,\xe2\x80\xa6 https://t.co/fCAt2q6dju'","b'hadirnya permendikbud ppks mendesak kampus untuk bentuk satgas. namun, bagaimana di unmul?\n\nsimak,\xe2\x80\xa6 https://t.co/fcat2q6dju'",hadirnya permendikbud ppks mendesak kampus untuk bentuk satgas namun bagaimana di unmul nsimak  xa,"['hadirnya', 'permendikbud', 'ppks', 'mendesak', 'kampus', 'untuk', 'bentuk', 'satgas', 'namun', 'bagaimana', 'di', 'unmul', 'nsimak', 'xa']","['hadirnya', 'permendikbud', 'ppks', 'mendesak', 'kampus', 'untuk', 'bentuk', 'satgas', 'namun', 'bagaimana', 'di', 'unmul', 'nsimak', 'xa']",hadirnya permendikbud ppks mendesak kampus bentuk satgas unmul nsimak,hadir permendikbud ppks desak kampus bentuk satgas unmul nsimak,1,
616,"b'Hah !!!!\nPantaskah kita diamkan ???\n@mohmahfudmd\n@DivHumas_Polri\n\nMahasiswa di Medan Demo Dukung Khilafah, Tuding P\xe2\x80\xa6 https://t.co/vUDMKUDJK9'","b'hah !!!!\npantaskah kita diamkan ???\n@mohmahfudmd\n@divhumas_polri\n\nmahasiswa di medan demo dukung khilafah, tuding p\xe2\x80\xa6 https://t.co/vudmkudjk9'",hah npantaskah kita diamkan di medan demo dukung khilafah tuding  xa,"['hah', 'npantaskah', 'kita', 'diamkan', 'di', 'medan', 'demo', 'dukung', 'khilafah', 'tuding', 'xa']","['hah', 'npantaskah', 'kita', 'diamkan', 'di', 'medan', 'demo', 'dukung', 'khilafah', 'tuding', 'xa']",hah npantaskah diamkan medan demo dukung khilafah tuding,hah npantaskah diam medan demo dukung khilafah tuding,0,
261,"b'Hai, Soka!\n\nSudah tahu tentang Permendikbudristek Nomor 30 Tahun 2021, kan?  Bagi yang belum tahu, nih Mika kasih i\xe2\x80\xa6 https://t.co/hYJfypUjHm'","b'hai, soka!\n\nsudah tahu tentang permendikbudristek nomor 30 tahun 2021, kan?  bagi yang belum tahu, nih mika kasih i\xe2\x80\xa6 https://t.co/hyjfypujhm'",hai soka nsudah tahu tentang permendikbudristek nomor tahun kan bagi yang belum tahu nih mika kasih  xa,"['hai', 'soka', 'nsudah', 'tahu', 'tentang', 'permendikbudristek', 'nomor', 'tahun', 'kan', 'bagi', 'yang', 'belum', 'tahu', 'nih', 'mika', 'kasih', 'xa']","['hai', 'soka', 'nsudah', 'tahu', 'tentang', 'permendikbudristek', 'nomor', 'tahun', 'kan', 'bagi', 'yang', 'belum', 'tahu', 'nih', 'mika', 'kasih', 'xa']",hai soka nsudah permendikbudristek nomor nih mika kasih,hai soka nsudah permendikbudristek nomor nih mika kasih,1,
2883,b'hal simpel begini aja kok malah pada dibikin ruwet.... https://t.co/7H6Tb2BHnR',b'hal simpel begini aja kok malah pada dibikin ruwet.... https://t.co/7h6tb2bhnr',hal simpel begini aja kok malah pada dibikin ruwet,"['hal', 'simpel', 'begini', 'aja', 'kok', 'malah', 'pada', 'dibikin', 'ruwet']","['hal', 'simpel', 'begini', 'aja', 'kok', 'malah', 'pada', 'dibikin', 'ruwet']",simpel aja dibikin ruwet,simpel aja bikin ruwet,1,
5359,b'Hallo Geografella!\n\nBEM Fakultas Geografi menyatakan sikap mendukung dan mendesak implementasi Permendikbud Ristek\xe2\x80\xa6 https://t.co/gt9G7mffe2',b'hallo geografella!\n\nbem fakultas geografi menyatakan sikap mendukung dan mendesak implementasi permendikbud ristek\xe2\x80\xa6 https://t.co/gt9g7mffe2',hallo geografella nbem fakultas geografi menyatakan sikap mendukung dan mendesak implementasi permendikbud ristek  xa,"['hallo', 'geografella', 'nbem', 'fakultas', 'geografi', 'menyatakan', 'sikap', 'mendukung', 'dan', 'mendesak', 'implementasi', 'permendikbud', 'ristek', 'xa']","['hallo', 'geografella', 'nbem', 'fakultas', 'geografi', 'menyatakan', 'sikap', 'mendukung', 'dan', 'mendesak', 'implementasi', 'permendikbud', 'ristek', 'xa']",hallo geografella nbem fakultas geografi sikap mendukung mendesak implementasi permendikbud ristek,hallo geografella nbem fakultas geografi sikap dukung desak implementasi permendikbud ristek,1,
578,b'Hallo pak menko @mohmahfudmd \nYg seperti di berita ini bukan masalah sepele lho pak.\nApa harus dibiarkan?\n\nhttps://t.co/ynL4MYJDZM',b'hallo pak menko @mohmahfudmd \nyg seperti di berita ini bukan masalah sepele lho pak.\napa harus dibiarkan?\n\nhttps://t.co/ynl4myjdzm',hallo pak menko nyg seperti di berita ini bukan masalah sepele lho pak napa harus dibiarkan,"['hallo', 'pak', 'menko', 'nyg', 'seperti', 'di', 'berita', 'ini', 'bukan', 'masalah', 'sepele', 'lho', 'pak', 'napa', 'harus', 'dibiarkan']","['hallo', 'pak', 'menko', 'nyg', 'seperti', 'di', 'berita', 'ini', 'bukan', 'masalah', 'sepele', 'lho', 'pak', 'napa', 'harus', 'dibiarkan']",hallo menko nyg berita sepele lho napa dibiarkan,hallo menko nyg berita sepele lho napa biar,1,
839,b'Haloo pak @KAPOLDAsumut @mohmahfudmd @nadiemmakarim\n@BadanIntelegent \nKenapa sayap organisasi terlarang HTI masih d\xe2\x80\xa6 https://t.co/McYjBVaYFT',b'haloo pak @kapoldasumut @mohmahfudmd @nadiemmakarim\n@badanintelegent \nkenapa sayap organisasi terlarang hti masih d\xe2\x80\xa6 https://t.co/mcyjbvayft',haloo pak nkenapa sayap organisasi terlarang hti masih  xa,"['haloo', 'pak', 'nkenapa', 'sayap', 'organisasi', 'terlarang', 'hti', 'masih', 'xa']","['haloo', 'pak', 'nkenapa', 'sayap', 'organisasi', 'terlarang', 'hti', 'masih', 'xa']",haloo nkenapa sayap organisasi terlarang hti,haloo nkenapa sayap organisasi larang hti,,9
934,b'Headline Nasional | KAMMI Tolak RUU TPKS dan Cabut Permendikbudristek PPKS -\nhttps://t.co/gfkVbXEetl\n#headlinebogor\xe2\x80\xa6 https://t.co/tiTTG53eb3',b'headline nasional | kammi tolak ruu tpks dan cabut permendikbudristek ppks -\nhttps://t.co/gfkvbxeetl\n#headlinebogor\xe2\x80\xa6 https://t.co/tittg53eb3',headline nasional kammi tolak ruu tpks dan cabut permendikbudristek ppks,"['headline', 'nasional', 'kammi', 'tolak', 'ruu', 'tpks', 'dan', 'cabut', 'permendikbudristek', 'ppks']","['headline', 'nasional', 'kammi', 'tolak', 'ruu', 'tpks', 'dan', 'cabut', 'permendikbudristek', 'ppks']",headline nasional kammi tolak ruu tpks cabut permendikbudristek ppks,headline nasional kammi tolak ruu tpks cabut permendikbudristek ppks,0,
4541,"b'Hr ini sy bersama narsum lainnya, Rektor @MetroIain &amp; Ibu Maria komisioner @KomnasPerempuan, membincangkan Permendi\xe2\x80\xa6 https://t.co/EpYrdYeJJG'","b'hr ini sy bersama narsum lainnya, rektor @metroiain &amp; ibu maria komisioner @komnasperempuan, membincangkan permendi\xe2\x80\xa6 https://t.co/epyrdyejjg'",hr ini sy bersama narsum lainnya rektor amp ibu maria komisioner membincangkan permendi  xa,"['hr', 'ini', 'sy', 'bersama', 'narsum', 'lainnya', 'rektor', 'amp', 'ibu', 'maria', 'komisioner', 'membincangkan', 'permendi', 'xa']","['hr', 'ini', 'sy', 'bersama', 'narsum', 'lainnya', 'rektor', 'amp', 'ibu', 'maria', 'komisioner', 'membincangkan', 'permendi', 'xa']",hr sy narsum rektor amp maria komisioner membincangkan permendi,hr sy narsum rektor amp maria komisioner bincang permendi,,9
806,b'HTI makin berani aja demo ngatain Pemerintah Thogut sambil mengkampanyekan Khilafah. \n@mohmahfudmd @henrysubiakto\xe2\x80\xa6 https://t.co/hjqE4JgkT9',b'hti makin berani aja demo ngatain pemerintah thogut sambil mengkampanyekan khilafah. \n@mohmahfudmd @henrysubiakto\xe2\x80\xa6 https://t.co/hjqe4jgkt9',hti makin berani aja demo ngatain pemerintah thogut sambil mengkampanyekan khilafah,"['hti', 'makin', 'berani', 'aja', 'demo', 'ngatain', 'pemerintah', 'thogut', 'sambil', 'mengkampanyekan', 'khilafah']","['hti', 'makin', 'berani', 'aja', 'demo', 'ngatain', 'pemerintah', 'thogut', 'sambil', 'mengkampanyekan', 'khilafah']",hti berani aja demo ngatain pemerintah thogut mengkampanyekan khilafah,hti berani aja demo ngatain perintah thogut kampanye khilafah,0,
791,b'@Dennysiregar7 @PDemokrat @jokowi HTI makin berani aje demo ngatain Pemerintah Thogut sambil mengkampanyekan Khilaf\xe2\x80\xa6 https://t.co/yEtpake1jN',b'@dennysiregar7 @pdemokrat @jokowi hti makin berani aje demo ngatain pemerintah thogut sambil mengkampanyekan khilaf\xe2\x80\xa6 https://t.co/yetpake1jn',hti makin berani aje demo ngatain pemerintah thogut sambil mengkampanyekan khilaf  xa,"['hti', 'makin', 'berani', 'aje', 'demo', 'ngatain', 'pemerintah', 'thogut', 'sambil', 'mengkampanyekan', 'khilaf', 'xa']","['hti', 'makin', 'berani', 'aje', 'demo', 'ngatain', 'pemerintah', 'thogut', 'sambil', 'mengkampanyekan', 'khilaf', 'xa']",hti berani aje demo ngatain pemerintah thogut mengkampanyekan khilaf,hti berani aje demo ngatain perintah thogut kampanye khilaf,0,
800,b'HTI makin berani aje demo ngatain Pemerintah Thogut sambil mengkampanyekan Khilafah \nhttps://t.co/1yovIs7ffh',b'hti makin berani aje demo ngatain pemerintah thogut sambil mengkampanyekan khilafah \nhttps://t.co/1yovis7ffh',hti makin berani aje demo ngatain pemerintah thogut sambil mengkampanyekan khilafah,"['hti', 'makin', 'berani', 'aje', 'demo', 'ngatain', 'pemerintah', 'thogut', 'sambil', 'mengkampanyekan', 'khilafah']","['hti', 'makin', 'berani', 'aje', 'demo', 'ngatain', 'pemerintah', 'thogut', 'sambil', 'mengkampanyekan', 'khilafah']",hti berani aje demo ngatain pemerintah thogut mengkampanyekan khilafah,hti berani aje demo ngatain perintah thogut kampanye khilafah,0,
422,b'ibuku nonton re-run mata najwa soal ppks:\xe2\x80\x9d',b'ibuku nonton re-run mata najwa soal ppks:\xe2\x80\x9d',ibuku nonton re run mata najwa soal ppks xe,"['ibuku', 'nonton', 're', 'run', 'mata', 'najwa', 'soal', 'ppks', 'xe']","['ibuku', 'nonton', 're', 'run', 'mata', 'najwa', 'soal', 'ppks', 'xe']",ibuku nonton re run mata najwa ppks xe,ibu nonton re run mata najwa ppks xe,1,
1019,b'IKM UI yang ingin mengikuti aksi harap terlebih dahulu mengisi tautan: \nhttps://t.co/c40dMnsAvZ\n\nAksi ini juga turu\xe2\x80\xa6 https://t.co/juI698Nu37',b'ikm ui yang ingin mengikuti aksi harap terlebih dahulu mengisi tautan: \nhttps://t.co/c40dmnsavz\n\naksi ini juga turu\xe2\x80\xa6 https://t.co/jui698nu37',ikm ui yang ingin mengikuti aksi harap terlebih dahulu mengisi tautan ini juga turu  xa,"['ikm', 'ui', 'yang', 'ingin', 'mengikuti', 'aksi', 'harap', 'terlebih', 'dahulu', 'mengisi', 'tautan', 'ini', 'juga', 'turu', 'xa']","['ikm', 'ui', 'yang', 'ingin', 'mengikuti', 'aksi', 'harap', 'terlebih', 'dahulu', 'mengisi', 'tautan', 'ini', 'juga', 'turu', 'xa']",ikm ui mengikuti aksi harap mengisi tautan turu,ikm ui ikut aksi harap isi taut turu,0,
120,"b'@ne4lene Ikrrrr , maknanya student kv ppks tok extraaa la ahahahaha nasib laa kita dah dipateh molah MoM . I mean m\xe2\x80\xa6 https://t.co/1JCZfhn51n'","b'@ne4lene ikrrrr , maknanya student kv ppks tok extraaa la ahahahaha nasib laa kita dah dipateh molah mom . i mean m\xe2\x80\xa6 https://t.co/1jczfhn51n'",ikrrrr maknanya student kv ppks tok extraaa la ahahahaha nasib laa kita dah dipateh molah mom mean  xa,"['ikrrrr', 'maknanya', 'student', 'kv', 'ppks', 'tok', 'extraaa', 'la', 'ahahahaha', 'nasib', 'laa', 'kita', 'dah', 'dipateh', 'molah', 'mom', 'mean', 'xa']","['ikrrrr', 'maknanya', 'student', 'kv', 'ppks', 'tok', 'extraaa', 'la', 'ahahahaha', 'nasib', 'laa', 'kita', 'dah', 'dipateh', 'molah', 'mom', 'mean', 'xa']",ikrrrr maknanya student kv ppks tok extraaa la ahahahaha nasib laa dah dipateh molah mom mean,ikrrrr makna student kv ppks tok extraaa la ahahahaha nasib laa dah dipateh molah mom mean,,9
464,"b'Imperial udah sampai sini, di indo masih ribut2 soal permen ppks \xf0\x9f\xa5\xb2\xf0\x9f\xa5\xb2\xf0\x9f\xa5\xb2 https://t.co/IX5OZyULzj'","b'imperial udah sampai sini, di indo masih ribut2 soal permen ppks \xf0\x9f\xa5\xb2\xf0\x9f\xa5\xb2\xf0\x9f\xa5\xb2 https://t.co/ix5ozyulzj'",imperial udah sampai sini di indo masih ribut soal permen ppks xf xa xb xf xa xb xf xa xb,"['imperial', 'udah', 'sampai', 'sini', 'di', 'indo', 'masih', 'ribut', 'soal', 'permen', 'ppks', 'xf', 'xa', 'xb', 'xf', 'xa', 'xb', 'xf', 'xa', 'xb']","['imperial', 'udah', 'sampai', 'sini', 'di', 'indo', 'masih', 'ribut', 'soal', 'permen', 'ppks', 'xf', 'xa', 'xb', 'xf', 'xa', 'xb', 'xf', 'xa', 'xb']",imperial udah indo ribut permen ppks xf xb xf xb xf xb,imperial udah indo ribut permen ppks xf xb xf xb xf xb,0,
4089,"b'Implikasi Permendikbud no 30/2021 ttg PPKS adlh pelegalan Zina, kumpul, dan Free Sex. Kok ormas Islam:  Muhammadiya\xe2\x80\xa6 https://t.co/9pij8t2h7M'","b'implikasi permendikbud no 30/2021 ttg ppks adlh pelegalan zina, kumpul, dan free sex. kok ormas islam:  muhammadiya\xe2\x80\xa6 https://t.co/9pij8t2h7m'",implikasi permendikbud no ttg ppks adlh pelegalan zina kumpul dan free sex kok ormas islam muhammadiya  xa,"['implikasi', 'permendikbud', 'no', 'ttg', 'ppks', 'adlh', 'pelegalan', 'zina', 'kumpul', 'dan', 'free', 'sex', 'kok', 'ormas', 'islam', 'muhammadiya', 'xa']","['implikasi', 'permendikbud', 'no', 'ttg', 'ppks', 'adlh', 'pelegalan', 'zina', 'kumpul', 'dan', 'free', 'sex', 'kok', 'ormas', 'islam', 'muhammadiya', 'xa']",implikasi permendikbud no ttg ppks adlh pelegalan zina kumpul free sex ormas islam muhammadiya,implikasi permendikbud no ttg ppks adlh legal zina kumpul free sex ormas islam muhammadiya,0,
